location,address,phone_number,ratings,ratings_count
Nexus Seawoods,"Unit No Ff 53/54 , First Floor, Sector 40, Nexus Seawoods, Opposite Pantaloons, Navi Mumbai, Maharashtra, 400706",7428891364,4.6,601
Nerul,"Shop No 7 & 8, Shankar Thakur Sadan, Plot No 22 & 23, Nerul, Nerul West, Near Cake Factory, Navi Mumbai, Maharashtra, 400706",8929330320,4.8,609
Kalamboli II,"Shop No 05&06, Satyam Paradise CHS, Plot No 23 Sector, Opposite Sudhagad Education Society School, New Panvel Kalamboli, Navi Mumbai, Maharashtra, 410218",9953690584,4.9,378
Sector 5 Kopar Khairane,"Shop No 7 & 8, Aashiv Apartment, Plot No 74, Sector 5, Ghansoli Station Road, Kopar Khairane, Navi Mumbai, Maharashtra, 400709",8929469724,,0
Sanpada,"Shop No 3, Plot No 4/6, Seawoods Garden Chs, Sector 17, Sanpada, Sanpada, Navi Mumbai, Maharashtra, 400705",9582584546,4.8,520
"Hilton, New Panvel","Shop No 14, Plot No 140, Sector 1 S, New Panvel East, Near D Mart, Navi Mumbai, Maharashtra, 410206",8929174802,4.8,552
Sector 12 Kharghar,"Shop No 9, New Satara CHS, Plot No A /24 E, Sector 12, Kharghar Taluka Panvel, Navi Mumbai, Maharashtra, 410210",9873931921,4.6,27
Medical College Chowk,"Shop No 2 & 3, Vinayak Tower, Untkhana Road, Medical Square, Medical College Chowk, Nagpur, Maharashtra, 440009",9870561562,4.9,2604
Nadanvan West,"Ground Floor, Shop No 2 & 3, Anand Palace 5, Plot No 230, Nandanvan Main Road, Nagpur, Maharashtra, 440009",9582430865,4.9,1063
Jaripatka Nagpur,"UGF, Shop No 30 & 31, Ginger Square Mall, Ginger Square, Jaripatka Main Road, Jaripatka, Nagpur, Maharashtra, 440014",9582306386,4.9,1078
Dharampeth,"Groud Floor, Gupta Bhawan, Plot No 193, West High Court Road, Dharampeth, Dharampeth, Opposite Union Bank Of India, Nagpur, Maharashtra, 440010",8929273134,4.9,4726
Sadar,"Shop No 3 & 4, Poonam Arcade, Residency Road, Sadar, Nagpur, Maharashtra, 440001",8929301457,4.9,2228
Manish Nagar,"Ground Floor, Plot No 96, Bhartiya Society, Besa Beltrodi Square, Manish Nagar, Nagpur, Maharashtra, 440015",9999213925,4.9,1741
Hudkeshwar,"Shop No 111, Ram Bhau Bus Stop, Hudkeshwar Road, New Neharu Nagar, Near Mhalgi Nagar, Nagpur, Maharashtra, 440034",9873765896,4.9,1393
Abhyankar Nagar Nagpur,"Shubhashish Square, Shraddhanand Peth Square, S Ambazari Road, Abhyankar Nagar, Nagpur, Maharashtra, 440010",8956928821,,0
Saggardara,"Ground Floor, House No 528A, Adjacent to Vision Express, Sakkardara Main Road, Sakkardara, Nagpur, Maharashtra, 440009",8447036028,4.9,1714
Zingabai Takli,"Ground Floor, Plot No 6, Opposite Mahajan Palace, Godhani Road, Zingabai Takli, Post Mankapur, Nagpur, Maharashtra, 440030",8929279942,4.9,930
Hingna Road,"Ground Floor, Shop No 10, Jalaram Manglam, SRP Camp, Digdoh, Hingna Road, Nagpur, Maharashtra, 440016",9718010328,4.8,1391
Pratapnagar Square,"Plot No 75, Narayan Sadan, Atre Layout, Ring Road, Near Pratap Nagar Square, Nagpur, Maharashtra, 440022",7428890236,4.7,1040
Gokulpeth,"Purshottam Complex, Nort Bazar Road, Gokulpeth, Nagpur, Maharshtra, 440010",9582476098,4.8,1050
Panchsheel Square,"Shop No 4 & 5, Rajkamal Complex, Dhantoli, Near Panchsheel Square, Nagpur, Maharashtra, 440012",8929310929,4.8,2324
Manewada Nagpur,"Plot No 176, Balaji Nagar, Venu Corner, Manewada Road, Nagpur, Maharashtra, 440027",8929306411,4.9,1896
Simpoli Borivali West,"Shop No 2, Deep Jyot, CHSL, Shimpoli Road, Rayani Gram, Borivali West, Mumbai, Maharashtra, 400092",9873942210,4.9,198
Nalasopara West,"Shop No 14, Aster Apartment, Nalasopara West, Near Shri Prashtha, Mumbai, Maharashtra, 401203",8447731721,4.9,1275
Kamothe,"Shop No 10, Uma Shiv Corner, Plot No 22 & 22A, Sector 19, Kamothe, Navi Mumbai, Maharashtra, 410206",8929435317,4.9,1482
Bhoomi Mall Belapur,"Shop No 27, Bhoomi Mall, Sector 15, Palm Beach Road Cbd Belapur, Belapur, Navi Mumbai, Maharashtra, 400614",8588921425,4.6,550
Thakur Village Kandivali East,"Shop No 09, Viceroy Savana, 120 Feet Road, Thakur Village Kandivali East, Mumbai, Maharashtra, 400101",9643968575,4.8,116
Kandivali West,"Shop No 35, Profit Center, Boraspada Road, Kandivali West, Opposite Panchsheel Heights, Mumbai, Maharashtra, 400067",7428891118,4.6,1158
Kharghar,"Shop No 7, Ground Floor, The Crown Plaza, Gharkul, Sector-15, Kharghar, Near D Mart, Navi Mumbai, Maharashtra, 410210",9319364916,4.8,494
Hutatma Chowk,"Shop No 46, Ground Floor, Islam Building, Hutatma Chowk, Fort, Near Flora Fountain, Mumbai, Maharashtra, 400001",7428891119,4.8,751
Santacruz West,"Shop No 1, Dheeraj Heritage, Best Colony, Juhu, Santacruz West, Opposite Kenia Hospital, Mumbai, Maharashtra, 400054",9319363645,4.8,910
Mahim,"Shop No 3, 4 & 5, Liliyan House, 145 B, L J Road, Mahim, Mumbai, Maharashtra, 400016",7428891120,4.6,2734
Breach Candy,"Shop No 5, Nanik Niwas Building, Bhulabhai Desai Road, Breach Candy, Opposite Tata Garden, Mumbai, Maharashtra, 400026",7428891121,4.9,1323
"Khanda Colony, Panvel","Shop Number 14/15, Tulsi Harmony, Sector 1, Khanda Colony, Greater Khanda, Panvel, Opposite Sai Prasad Hotel, Navi Mumbai, Maharashtra, 410206",8447732042,4.8,1104
Amboli,"Shop No 2, Ground Floor, Mayfair Meridian, Amboli, Andheri West, Caeser Road, Mumbai, Maharashtra, 400058",7428891132,4.8,2321
Juhu Tara Road,"Shop No 12, Vasant Bahar Chs Ltd, Juhu Tara Road, Juhu, Near Hotel Sea Princess, Mumbai, Maharashtra, 400049",9319362715,4.9,1170
Railway Station Road Vashi,"Shop No G 01, Sector 30A, Vashi Railway Station Road, Vashi, Navi Mumbai, Maharashtra, 400705",9582768117,4.9,42
Lower Parel,"Shop No 2, Sanghvi Building, Ganpar Rao Marg, Lower Parel, Near Dmart, Mumbai, Maharashtra, 400013",8929271737,4.8,665
Kalamboli,"Shop No 23, Ground Floor, Neelsiddhi Amarante Chs Ltd, Plot No 4, Sector 9E, Roadpalli, Kalamboli, Besides Manoj Medical, Navi Mumbai, Maharashtra, 410218",9319361975,4.8,487
Inorbit Mall Malad,"Unit No F 02, First Floor, Inorbit Mall, Link Road, Malad, Mumbai, Maharashtra, 400064",8655638541,,0
Panchanand Taloja,"Shop No 6, Panchnand Heights, Plot No 15-18, Sector 9, Opposite Shree Royal Chemist, Taloja, Raigad, Navi Mumbai, Maharashtra, 410208",7065053054,4.8,164
Atria Mall,"Shop No 42, Ground Floor, Atria Mall, Dr. Annie Bishant Road, Worli, Mumbai, Maharashtra, 400018",7303350351,4.8,1442
Dombivali,"Shop No 6, Kanchan Dhara Society, Raghuveer Nagar, Dombivali East, Opposite Godrej Showroom, Manpada Road, Mumbai, Maharashtra, 421201",7428891151,4.7,1045
Vile Parle East,"Shop No 26, C Wing, Agrawal Market, Shyam Kamal Road, Vile Parle East, Near Big Bazaar, Mumbai, Maharashtra, 400057",9319368027,4.9,2515
Mira Road East Mumbai,"Shop No 11 & 12, NG Estate, Mira Bhayandar Road, Near Old Petrol Pump, Mira Road East, Mumbai, Maharashtra, 401107",9582957478,4.8,9
Mulund West,"Shop No 55, Ground Floor, Munshi Estate, Plot No 504, 505, Mg Road, Mulund West, Below Gokul Hospital, Mumbai, Maharashtra, 400080",7428890103,4.8,1588
Ghatkopar West Mumbai,"Shop No 18/19, Sanskar Building, LBS Road, Kelkar Marg Shivaji Park, Opposite Sarvodaya Hospital, Ghatkopar West, Mumbai, Maharashtra, 400086",9967164315,5.0,20
Bhandup West,"Shop No 5, Ground Floor, Gaurai Arcade, Lbs Marg, Bhandup West, Near Domino'S Pizza, Mumbai, Maharashtra, 400078",7428891160,4.7,908
Sector 7 Kharghar Navi Mumbai,"Shop No 56, Plot No 15 & 17, Patel Heritage, Sector 7, Opposite Hiranandani Crystal Plaza, Kharghar, Navi Mumbai, Maharashtra, 410210",8655611094,4.7,16
Kharghar,"Shop No 1, Parth CHS, Plot No 228, Sector 13, Kharghar, Near Shilpa Chowk, Navi Mumbai, Maharashtra, 410210",7428890127,4.6,421
Bhandup West,"Shop No 4, Srishti Solitaire, Lal Bahadur Shastri Road, Sadan Wadi, Bhandup West, Mumbai, Maharashtra, 400078",9899412296,4.9,548
Linking Road Bandra,"Shop No 5 & 6, Swarna Rekha, Linking Road, Bandra West, Linking Road, Near Khar Telephone Exchange, Mumbai, Maharashtra, 400052",9582211424,4.8,2983
Chikuwadi Borivali West,"Sumit Garden Grove Daigonally, Chikuwadi, Borivali West, Opposite Pheonix Hospital, Mumbai, Maharashtra, 400092",8447893951,4.8,1889
Thane Mulund East,"Shop No 01, Romel Vasanthi, Navghar Road, Eastern Express Hwy, Near Mulund Gymkhana, Deendayal Nagar, Mulund East, Mumbai, Maharashtra, 400081",9811076478,4.9,381
Oberoi Mall,"Shop No 6, Second Floor, Oberoi Mall, Yashodham Goregaon, Western Express Highway, Near Dindoshi Bus Stand, Mumbai, Maharashtra, 400063",9650611440,4.8,2264
Navare Ambernath East,"Ground Floor, Shop No 8 Tulip A, Project Nisarg Green, Near wellness forever, Cabin Road, Plot No RH1, Ambernath Industrial Area, Ambernath East, Munic, Mumbai, Maharashtra, 421503",9811038596,5.0,1
Sion Koliwada Mumbai,"Shop No 6 & 7, Hub Town Vedant, Sardar Nagar No 4, Mukundrao Ambedkar Road, GTB Nagar, Sion Koliwada, Mumbai, Maharashtra, 400037",8850111402,,0
Tilak Nagar,"Shop No 11, Krushal Tower, Tilak Nagar, Gm Road, Mumbai, Maharashtra, 400089",9873669399,4.9,1305
Sai Miracle Kharghar,"Shop No 7 Plot No 16, 17 / 19, Sector 34 E, Sector 35E, Kharghar, Near Hdfc Bank, Navi Mumbai, Maharashtra, 410210",8929261783,4.9,340
Sagar Garden Mulund,"Shop No 6 & 7, Ground Floor, Sagar Garden Complex, Lbs Road, Mulund West, Opposite Vasant Oscar, Mumbai, Maharashtra, 400080",9873431464,4.9,1236
Ghansoli,"Shop No 13-14, Manoshi Complex, Plot No 5 & 6, Sector 3, Ghansoli, Navi Mumbai, Maharashtra, 400701",9643409271,4.9,466
Ulwe,"Shop No 6 & 7, Radiant Sapphire, Plot No 179, Sector 9, Ulwe, Navi Mumbai, Maharashtra, 410206",9582334312,4.8,180
"Orion Mall, Panvel","Shop No G-4, Orion Mall, Plot No 311, Forest Colony, Panvel, Near St Depot, Navi Mumbai, Maharashtra, 410206",9582961434,4.7,638
Akurli Road Kandivali,"Shop No 13 & 14, National Avenue Building, Village Akurli Road, Kandivali East Bandra, Mumbai, Maharashtra, 400101",8169087690,,0
Colaba,"Shop No 4, Ruki Mahal, Shaheed Bhagat Singh Road, Colaba, Near Hp Petrol Pump, Mumbai, Maharashtra, 400005",7428891211,4.8,990
Naigaon,"Shop No 14, Global Arena, Sunteck West World, Tivri Road, Near Reliance Trends, Naigaon East, Mumbai, Maharashtra, 401208",9582557985,5.0,65
Runwal Green Mulund,"Shop No G17, Runwal Greens, Mulund, Goregaon Link Road, Next to Fortis Hospital, Mulund West, Mumbai, Maharashtra, 400078",8588816468,4.9,436
Borivali West,"Ground Floor, Shop No 12, Prasanna Jivan, CHS CTS No 32C, Eksar Village, Borivali West, Mumbai, Maharashtra, 400092",8929207768,,0
Dadar,"Shop 3, Om Ashirwad Building, Near ICICI Bank, Kelkar Marg, Shivaji Park, Dadar, Mumbai, Maharashtra, 400028",9582455891,4.7,422
Kopar Khairane,"Shop No 5 & 6, Plot No 18 & 19, Satyam Tower, Sector 20, Koperkhairane, Opposite Varishtta Hotel, Navi Mumbai, Maharashtra, 400709",8373911515,4.8,1221
Kharghar,"Shop No 23 & 24, Plot No 20, Sector 2, Kharghar, Sai Swar Cooperative Housing Society, Navi Mumbai, Maharashtra, 410210",9654921510,4.9,863
"R City Mall, Ghatkopar","Shop No F67, First Floor, LBS Marg, Amrut Nagar, R City Mall, Ghatkopar West, Mumbai, Maharashtra, 400086",7428891238,4.9,2681
"Sector 7, Airoli","Shop No G9, Shiv Shankar Plaza, , Sector 7, Airoli, Next To Domino'S Pizza, Navi Mumbai, Maharashtra, 400708",7428891243,4.6,769
"Sector 14, Koparkhairane","Shop No 3, Lotus Chs, Sector 14, Koparkhairane, Near D-Mart Chowk, Navi Mumbai, Maharashtra, 400709",7428890210,4.6,505
"Chandivali, Powai","Shop No 3, Lower Ground Floor, Wing C, Lake Primrose Commercial, Chandivali, Beside Lakme Salon, Mumbai, Maharashtra, 400076",7428891252,4.8,1511
Lokhandwala Andheri West,"Shop No 9 &10, Benzer CHS Ltd, 8B, Main Road, Lokhandwala Complex, Andheri West, Mumbai, Maharashtra, 400053",9582605270,4.9,755
Ulwe,"Shop No 4, Shagun Essentia, Plot No 5, Sector 19, Ulwe, , Ulwe, Near Hdfc Bank, Navi Mumbai, Maharashtra, 410206",7838199672,4.7,647
Dahisar,"Shop No 1&2, Manhar Residency, Kandarpada Circle, Opposite Hotel Majestic, Dahisar West, Mumbai, Maharashtra, 400068",8929172628,4.9,1819
Marol,"Shop No 5, Ground Floor, Radiant Tower 59, Marol Maroshi Road, Andheri East, Mumbai, Maharashtra, 400059",9582561743,4.8,190
MG Road Kandivali West,"Shop No 2 & 3 Burhani Heritage Chs Ltd, M G Road, Kandivali West, Opposite Bohra Masjid, Mumbai, Maharashtra, 400067",8929261281,4.9,813
Mira Road,"Antariksh Height, Shop No 2, Kanakia Road, Mira Road East, Opposite Kanakia Police Station, Mumbai, Maharashtra, 401107",8447705725,4.8,871
"Marol, Andheri East","Shop No 1, 2, Raj Apartment, Military Road, Marol, Andheri East, Opposite Raj Industrial Complex, Mumbai, Maharashtra, 400059",7428891272,4.7,718
Goregaon West,"Shop No 4, Ashokraj Chs, S V Road, Goregaon West, Opposite Hirnen Shopping Centre, Mumbai, Maharashtra, 400062",7428891274,4.8,1875
Varsova Kabra Metro One,"Shop No 13, Kabra Metro One, Pratap Chs Ltd, J P Road, Versova, Andheri West, Varsova, Near Versova Metro Station, Mumbai, Maharashtra, 400058",7428891288,4.9,1666
Xperia Mall,"Shop No 1/29, First Floor, Dombivali East, Opposite Lodha World School, Mumbai, Maharashtra, 421204",7428891284,4.8,726
Mumbai Central,"15, Ground Floor, B Wing, Santoshi Mata Chs, Dr Dadasaheb Bhadkamkar Marg, Near Saraswat Bank, Mumbai, Maharashtra, 400008",7428891037,4.9,1689
Growel Mall,"G 5A, Ground Floor, Akurli Road, Kandivali East, Growel Mall, Mumbai, Maharashtra, 400101",7428891291,4.9,1775
"Inorbit Mall, Vashi","Shop No F12, First Floor, Inorbit Mall, Vashi, Next To Vashi Station, Navi Mumbai, Maharashtra, 400705",7428891298,4.7,1093
"Domestic Terminal 2, Mumbai Airport","Chhatrapati Shivaji International Airport, Vile Parle East, Domestic Terminal 2, Second Shop On Left After Security Check, Mumbai, Maharashtra, 400099",7428891299,4.9,911
"Infiniti Mall, Malad","Shop No 18, Lower Ground Floor, Link Road, Malad West, Infiniti Mall, Malad, Opposite Iphone Store, Mumbai, Maharashtra, 400064",7428891300,4.9,2963
Seawoods,"Shop No 61 & 62, Shelter Arcade, Seawoods Sector 42, Navi Mumbai, Maharashtra, 400706",7303560561,4.6,521
Nancy Colony,"Shop No 1 & 2, Om Siddhagiri Co-Op Hsc Ltd, Sant Dyaneshwar Marg, Nancy Colony, Unity Bank, Shantivan, Borivali East, Mumbai, Maharashtra, 400066",9582599496,4.9,273
Badlapur East,"Shop No 5 & 7, Suryadarshan CHS, Katrap Road, Badalpur East, Mumbai, Maharashtra, 421503",9953642467,4.9,195
Mira Road,"Shop No 6, 7 & 001, Building No 61/62, Sector 1, Shanti Nagar, Mira Road East, Near Station Road, Mumbai, Maharashtra, 401107",7428891332,4.8,1802
Sector 9 Ghansoli,"Shop No 10, Trishul Gold Coast, Plot No 13, 14/15, Sector 9, Ghansoli, Navi Mumbai, Maharashtra, 400701",8929289728,4.8,615
Gupte Road Dombivali West,"Shop No A2, Channur Bhavan Royal Chemist, Vishnu Nagar, Navi Dombivali Gupte Road, Dombivali West, Mumbai, Maharashtra, 421202",9711602948,4.8,535
Kamothe,"Shop No 3, Ambe Sharddha, Chs Main Road Sector-34, Kamothe, Kamothe, Navi Mumbai, Maharashtra, 410206",9821311593,4.9,2325
"Phoenix Market City Mall, Kurla","Shop No F5, First Floor, Lbs Marg, Phoenix Market City Mall, Kurla West, Mumbai, Maharashtra, 400070",7428891011,4.6,1420
Kandivali East,"Shop No 44, Centrium, Lokhandwala Township, Kandivali East, Near Centrium Mall, Mumbai, Maharashtra, 400101",7428891353,4.9,991
Karanjade Panvel,"Shop No 21&22, Sai Vrindavan Chs, Plot No 164, Sector 4, Karanjade, Panvel, Navi Mumbai, Maharashtra, 410206",9667044045,4.9,441
"Sector 17, Vashi","Shop No 2, Ground Floor, Ashiana, Plot No 15, Vashi, Sunflower Road, Mumbai, Maharashtra, 400703",7428891053,4.6,663
Nexus Seawoods,"Unit No Ff 53/54 , First Floor, Sector 40, Nexus Seawoods, Opposite Pantaloons, Navi Mumbai, Maharashtra, 400706",7428891364,4.6,601
Nerul,"Shop No 7 & 8, Shankar Thakur Sadan, Plot No 22 & 23, Nerul, Nerul West, Near Cake Factory, Navi Mumbai, Maharashtra, 400706",8929330320,4.8,609
Thane West,"Shop No G/13, Niharika Shopping Center, Gladys Alvares Road, Pokhran 2, Thane West, Mumbai, Maharashtra, 400610",7428891056,4.7,1077
Kalamboli II,"Shop No 05&06, Satyam Paradise CHS, Plot No 23 Sector, Opposite Sudhagad Education Society School, New Panvel Kalamboli, Navi Mumbai, Maharashtra, 410218",9953690584,4.9,378
Borivali West,"Shop No 3, Sai Leela Chs, SV Road, Borivali West, Mumbai, Maharashtra, 400092",7428891062,4.6,1111
Adharwadi Kalyan West,"Shop No 14 & 15, Ritz The Business Bay Shree Complex, Jail Road, Bhagirathi Nagar, Adharwadi, Kalyan West, Mumbai, Maharashtra 421301",8929473387,4.8,359
Borivali,"Shop No 2&3, Ground Floor, Geetanjali Apartment, Ramdas Sutrale Marg, Borivali West, Near Icici Bank, Mumbai, Maharashtra, 400092",9818301622,4.7,979
Chembur,"11A, Ground Floor, Rajhans Building, Narayan Gajanan Acharya Marg, Chembur East, Opposite Chembur Railway Station, Mumbai, Maharashtra, 400071",7428891069,4.5,878
Sector 5 Kopar Khairane,"Shop No 7 & 8, Aashiv Apartment, Plot No 74, Sector 5, Ghansoli Station Road, Kopar Khairane, Navi Mumbai, Maharashtra, 400709",8929469724,,0
Chembur,"Shop No 2, Ganesh Bhuvan, Dk Sandu Marg, Chembur, Opposite Icici Bank, Mumbai, Maharashtra, 400071",9667267268,4.6,579
IC Colony Borivali West,"Shop No 8, Ground Floor, Audumbar Chhaya, Co-Operative Housing Society Ltd, 34, Ami Kailash Building, Opposite Yes Bank, I C Colony, Borivali West, Mumbai, Maharashtra, 400103",8929599762,4.9,207
Sanpada,"Shop No 3, Plot No 4/6, Seawoods Garden Chs, Sector 17, Sanpada, Sanpada, Navi Mumbai, Maharashtra, 400705",9582584546,4.8,520
"SV Road, Andheri West","Shop No 06 Monisha Building, Swami Vivekananda Road, SV Road, Andheri West, Mumbai, Maharashtra, 400058",9953550832,4.9,760
"Hilton, New Panvel","Shop No 14, Plot No 140, Sector 1 S, New Panvel East, Near D Mart, Navi Mumbai, Maharashtra, 410206",8929174802,4.8,552
Ambawadi Girgaon,"117H Ground Floor, Mantri Building, Jagannath Shankarsheth Marg, Ambawadi Girgaon, Mumbai, Maharashtra, 400004",9582241726,4.9,912
Malad East Mumbai,"Shop No 1 & 2, Ganesh Bhuvan, Daftary Road, Malad East, Mumbai, Maharashtra, 400097",8929306562,4.8,1600
Vasai,"Shop No 5, Marvel Building Broadway, Vasai East, Virar, Opposite Carnival Cinema, Mumbai, Maharashtra, 401208",8447745125,4.9,849
Sector 12 Kharghar,"Shop No 9, New Satara CHS, Plot No A /24 E, Sector 12, Kharghar Taluka Panvel, Navi Mumbai, Maharashtra, 410210",9873931921,4.6,27
Malad West,"Unit No 1, Simplex Khush Angan, Sv Road, Malad West, Opposite L M Patel Rotary Eye Hospital, Mumbai, Maharashtra, 400064",7428891130,4.8,1368
Rajarampuri,"Shop No 1, Ground Floor, 1754 E, Ward Sripati Apartment, Rajarampuri 4Th Lane, Kolhapur, Maharashtra, 416003",7428890012,4.8,2782
Tarabai Park,"Shop No 1, Shweta Apartment, Damini Hotel Road, Tarabai Park, Near Sasane Ground, Kolhapur, Maharashtra, 416003",8929277342,4.9,986
Shahupuri,"Shop No 03, Ground Floor, Arihant Chamber, 762, Karvir, Shahupuri, Kolhapur, Maharashtra, 416001",9899413483,4.9,229
Lal Chowky,"Shop No 9 & 24 Ground Floor, Sunsoman Square, Agra Road, Lal Chowky, Opposite Indus Bank, Kalyan West, Maharashtra, 421301",7065035390,4.9,1063
Kalyan Khadakpada Circle,"Shop No 8, B Wing, Shree Swamiprasad Chs, Khadakpada Circle, Near Mcdonald'S, Kalyan, Maharashtra, 421301",7428891172,4.7,917
Metro Junction Mall,"Ground Floor, Unit No G2, Metro Junction Mall, Shilphata Road, Netivali, Shilphata Road, Kalyan, Maharashtra, 421306",9711701499,4.9,1198
Kalyani,"B-12/17, B Block, Central Park, Nadia Kalyani, Beside Frank Ross Pharmacy, Kalyani, West Bengal, 741235",8929335877,4.9,800
Kachore Goan Kalyan,"Shop No 7 & 8, Shivom Galaxy, Pisavli Village, Nandivali, Kachore Goan, Near Amaya Hospital, Kalyan, Maharashtra, 421306",8447941928,4.9,609
Bail Bazar,"Shop No 16, Aum Supreme, Plot No 4 To 9, Bail Bazaar, Next To D-Mart, Kalyan, Maharashtra, 421301",9818771621,4.8,1002
Nirala Bazar,"Shop No 43 & 44, Samarth Nagar, Nirala Bazar, Opposite M.P Law College, Aurangabad, Maharashtra, 431001",8448440317,4.9,1604
Akashwani Chowk,"Shop No 3 & 4, Ahinsa Bhawan, Plot No 1, Ahinsa Nagar, Akashwani Chowk, Jalna Road, Beside Wellness Forever, Aurangabad, Maharashtra, 431001",8929264486,4.9,1241
Beed Bypass Road Aurangabad,"Shop No 2, Maru Plaza, Plot No 9 & 10, Gut No 115, Opposite Nayara Petrol Pump, Beed Bypass Road, Aurangabad, Maharashtra, 431122",8147208649,5.0,63
TV Center Road,"1 GF, Plot No N 11/A, Adjacent to Saraswat Bank, TV Center Road, Hudco, Aurangabad, Maharashtra, 431003",8447570185,4.9,540
Connaught Place,"Shop No 12, Raj Sarathi Apartment, Connaught Place, Aurangabad, Maharashtra, 431003",8929176458,4.9,1418
"Prozone Mall, Aurangabad","P 80, Prozone Mall, Unit No G 53, Midc Api Road, Chilkalthana, Near Mcdonalds, Aurangabad, Maharashtra, 431210",7428891313,4.8,1186
Usmanpura,"Shop Number 5, Ventigo Complex, Usmanpura, Opposite Bank Of Baroda, Aurangabad, Maharashtra, 431005",8376801264,4.9,1806
Aurangabad,"Mg Road, Near Bank Of India, Mg Road, Aurangabad, Bihar, 824101",8929160805,4.9,452
Sutgirni Chowk,"Shop No 16, Space Olampia, Sutgirni Chowk, Aurangabad, Maharashtra, 431005",9319361995,4.9,2035
Flagship Store Court Road,"Ground Floor, Mahalakshmi Towers, Court Road, Near Big Bazaar, Udupi, Karnataka, 576101",8929346386,4.9,4103
Hanuman Circle Tenkapet,"VK Paradise, Ground Floor, Moodanidambur Village, Hanuman Circle, Tenkapet, Sanskrit College Road, Udupi, Karnataka, 576101",7291082898,5.0,101
Udupi,"G4, Ground Floor, Mandavi Royal Prince, Kunjibettu, Opposite Kunjibettu Post Office, Udupi, Karnataka, 576102",7428890295,4.9,3073
SIT Tumkur,"No 2164/796, Sit Main Road, Near 11Th Cross, Tumkur, Karnataka, 572103",8929344598,4.8,3004
General Cariappa Road,"Shop No 1861/A/846, Krishna Arcade, 2Nd Cross Road, General Cariappa Road, Next To Mg Road, K R Extension, Tumkur, Karnataka, 572101",7428890166,4.8,6422
URS Road,"Shop No 9, D Devaraja, Urs Road, Next To City Bus Stop, Mysuru, Karnataka, 570001",7428890102,4.9,12585
Siddhartha Layout,"176, Gani Complex, Dr. Rajkumar Rroad, Raghavendra And Nazarbad Mohalla, Opposite Shubodaya Hospital, Mysuru, Karnataka, 570011",8929442765,4.9,1213
"Vijay Nagar, Mysuru","Site No 7696, Vijay Nagar, 2nd Phase, 4th Stage, 80 feet Road, Near Marimallappa School, Devaraja Mohall, Mysuru, Karnataka, 570026",9582554529,4.9,310
Forum Mall,"Shop No 8 & N 5, Lgf, Forum Mall, Hyder Ali Road, Nazarbad Mohalla, Mysuru, Karnataka, 570010",7428891237,4.9,3103
Mall Of Mysore,"C1, First Floor, Mall Of Mysore, FF14, MG Road, Indiranagar Extension, Nazarbad Mohalla, Near Mysuru Race Club, Mysuru, Karnataka, 570010",8743826180,4.9,790
JP Nagar,"No 301, E Block, JP Nagar, Layout Nachahalli, Khille Mohalla, Mysuru, Karnataka, 570008",9582612295,4.9,425
Kuvempunagara,"Mig 2, Ground Floor, New Kantharaja Urs Road, Kuvempunagara, Near Sri S. Nijalingappa Circle, Mysuru, Karnataka, 570023",7428890271,4.9,7183
Saraswathipuram,"2904/1, Khada No Ch 66, Kantharaj Urs Road, Saraswathipuram, Beside Fire Brigade, Mysuru, Karnataka, 570009",8929342669,4.9,2614
Kalidasa Road,"Shop No 2813 D-1A, Ground Floor, Ganesh Arcade, Kalidasa Road, Above Green Leaf Hotel, Mysuru, Karnataka, 570002",7428890303,4.9,3414
Chamundipuram,"New No 2954/4, Plot No K 12/4, Khata No 38/2004, Chamundipuram Circle, Next To More Market, Mysuru, Karnataka, 570008",8588802291,4.9,4395
Vijay Nagar,"Hebbal 1St Stage, Jv Arcade, Hebbal, Near Surya Bakery Circle, Mysuru, Karnataka, 570016",7065045161,4.9,1749
Dattagalli,"N0 3082, Khata Kt695/17/18, Vishwamanava Double Road, 3Rd Stage, Dattagalli, Mahamane Circle, Mahamane Circle, Near Bombatt Bhojana Hotel, Mysuru, Karnataka, 570024",8929310911,5.0,1900
Sindhanur,"C M C No- 6-1-1926, Ashapuri Complex, Gangavathi Road, Sindhanur, Opposite Axis Bank, Raichur, Karnataka, 584128",8929338697,5.0,2126
Brestwarpet,"No 11-2-61 & 62, Sangeeta Arcade, Bresthwarpet, Near Gandhi Chowk, Bresthwarpet, Opposite Kanva Hospital, Raichur, Karnataka, 584101",7428890217,4.9,2388
Deralakatta Road Ullal Mangaluru,"RBM Complex, JM Road, Deralakatta Road, Near DD Cars, Ullal, Mangaluru, Karnataka, 575022",9582648228,4.9,111
Surathkal,"Survey No 2-35/2, Khata No 3542 & 2-35/6, Hosabettu, Surathkal, Mangaluru, Karnataka, 575019",7291097439,4.9,65
Bejai Road,"Ug13, 3W3-268/25, Marian Paradise Streak, Bejai Road, Near Bejai Church, Mangaluru, Karnataka, 575004",8929306412,4.9,1989
Kankanady,"Rajsan Complex, Ground Floor, No 1-16/2-5, Pumpwell Road, Kankanady, Kankanady, Near Omega Hospital, Mangaluru, Karnataka, 575002",8929310301,4.9,3489
Hampankatta,"Ground Floor, Premium Enclave, Light House Hill Road, Hampankatta, Opposite To Canara Bank, Mangaluru, Karnataka, 575001",8929277874,4.9,3330
Nexus Mall,"Shop No 11A, 1St Floor, Nexus Mall, Mangladevi Temple Road, Pandeshwar, Mangaluru, Karnataka, 575001",8585951403,4.9,2371
RNS Road,"RNS Road, Chaitanya Nagar, Opposite Giant School, Rajendra Nagar, Hubli, Karnataka, 580030",7291823825,4.9,424
Vidya Nagar,"35498/23, Vidya Nagar, Ramakrishna Layout, Unkal Village, Hubli, Karnataka, 580030",8929342563,4.8,1268
Koppikar Road,"Shop No 10, Ground Floor, Eureka Corner, Koppikar Road, Eureka Building, Hubli, Karnataka, 580020",7428890260,4.9,2457
Station Road,"Ward No 1, Sardar Mehaboob Ali khan Road, Hubli City, Taluka Ward No 46, Municipal No 2724, Near Station Road, Hubli, Karnataka, 580028",8364062908,5.0,110
Station Road,"Ward No 1, Sardar Mehaboob Ali khan Road, Hubli City, Taluka Ward No 46, Municipal No 2724, Near Station Road, Hubli, Karnataka, 580028",9953781492,5.0,110
Navanagar Hubli,"Plot No. 7, E.W.S. Block No 10 to 22, Sri Ganesh Prasad Sabha Graha, HIG 57 2nd Cross Hubli Taluk, Navananagar, Hubli, Karnataka, 580025",8929592186,4.9,213
Keshwapur,"Vivanata Building, CTS No 439/1A-15, Ward No 30, Subhas Nagar, Kusugal Road, Keshwapur, Hubballi, Karnataka, 580023",8510801592,4.9,453
Vidya Nagar,"No 06 , Wali Arcade, Opposite J G commerce College, Vidya Nagar, PB Road, Hubballi, Karnataka, 580021",9582580560,4.9,562
Court Road Gulbarga,"Shop No-19, 1St Floor, Venkateshwara Marata Shetty, Kalaburgi, Gulbarga Court Road, Near Forest Office, Gulbarga, Karnataka, 585102",9319368896,4.9,3642
