location,address,phone_number,ratings,ratings_count
Malviya Road,"Malviya Road, Near Union Bank, Malviya Road, Deoria, Uttar Pradesh, 274001",7303974975,4.7,252
Dwarka Puri Colony,"Plot No 7 Ground Floor, Dwarka Puri Colony, Bhuteshwar Road, Mathura, Uttar Pradesh, 281001",9582268921,4.9,226
Pilibhit,"Naugawan Pakariya, Near Chatri Chauraha, Tanakpur Road, Nai Basti, Pilibhit, Uttar Pradesh, 262001",8742988012,4.9,268
Phoenix Palassio Mall,"T-35, Third Floor, Phoenix Palassio Mall, Sector 7, Gomti Nagar Extension, Amar Saheed Path, Near Ekana Stadium, Lucknow, Uttar Pradesh, 226010",7303842843,4.9,1235
Gomti Nagar Extension,"Ground Floor, House No 1/746, Vardan Khand, Near Kotak Mahendra Bank, Sector 1, Gomti Nagar Extension, Lucknow, Uttar Pradesh, 226010",9582598625,5.0,153
Shakti Chowk,"First Floor, 198/53, Sd Puram Colony, Gate No 1, Civil Lines 1, Shakti Chowk, Bijnor, Uttar Pradesh, 246701",8447830154,4.9,747
Narendrapur,"1029, N S Road, Narendrapur, Kolkata, West Bengal, 700103",9643831508,4.9,906
Malancha Road,"838/608, Malancha Road, Paschim Medinipur, Kharagpur, West Bengal, 721304",9311773750,4.9,1149
Santoshpur,"Santoshpur Ave, New Santoshpur, Santoshpur, Near Jora Bridge, Kolkata, West Bengal, 700075",7303353354,4.9,1525
Birati,"1040, M B Road, Siddheswari Bazar, North Dumdum, Birati, North 24 Parganas, Birati, Beside Hdfc Atm, Kolkata, West Bengal, 700051",7290017585,4.9,1570
Swimming Pool,"Swimming Pool, Cf211, Cf Block, Sector 1 Bidhannagar, Salt Lake, Sector 1 Bidhannagar, Near Sharma Tea, Kolkata, West Bengal, 700064",8929275215,5.0,616
Sai Baba Colony,"Ground Floor, #169, NSR Road, Saibaba Colony, Shaganoor, Coimbatore, Tamil Nadu, 641011",8447806828,4.9,514
Vellore,"No 19/140, Laxman Complex, Arni Road, Near Cmc Eye Hospital, Vellore, Tamil Nadu, 632001",8447745010,4.9,3592
Nanganallur,"38/13, 1St Main Road, Macmillan Colony, Nanganallur, Chennai, Tamil Nadu, 600061",9667253254,4.9,3709
Namakkal,"321/113B, Salem Road, Opposite Hotel Sanu International, Namakkal, Tamil Nadu, 637001",8929288494,4.8,723
Mettur Road Erode,"229, EVN Road, Mettur Road, Erode, Tamil Nadu, 638001",9643708714,4.8,58
Mirzapur,"Giridhar Ka Chauraha, Badli Katra Road, Near City Kart, Mirzapur, Uttar Pradesh, 231001",8743851567,4.9,291
Aliganj2,"HS 1/6 Sector A, Sitapur Road Yojna, Near Ram Ram Bank Chauraha, Aliganj, Lucknow, Uttar Pradesh, 226021",9582612107,5.0,527
VVIP Mall,"G 18, Vvip Mall, Nh 58, Raj Nagar Extension, Noor Nagar, Near Heera Sweets, Ghaziabad, Uttar Pradesh, 201001",7428891312,4.8,624
Panchsheel,"Shop No Gf 43 Ground Floor, Plot No Gh 1, Link Road, Greno West, Link Road, Near Guru Di Hatti, Greater Noida, Uttar Pradesh, 201306",9643107980,4.9,841
Govindpuram,"Shop No 20 & 21, Gf, Signature Street, G Block, Govindpuram, Ghaziabad, Uttar Pradesh, 201013",8929436779,4.9,557
Sector 44,"Ground Floor, Left Side, C-513, Near Union Bank, Sector 44, Noida, Uttar Pradesh, 201301",9582620327,5.0,321
Balurghat,"Hilli More, Beside Prestige Xclusive, Hilli More, Opposite Reliance Trends, Balurghat, West Bengal, 733101",8929225205,5.0,936
Bolpur,"Provat Soroni Road, Po & Ps, Bolpur, Birbhum, Opposite Bata Showroom, Bolpur, West Bengal, 731204",8929607549,4.9,964
Chakdah,"Dag No 1958, Khatian No 1709, J L No 20, Mouza, Lalpur, Opposite New Loknath Automobiles, Chakdaha, West Bengal, 741222",8376801083,4.9,1205
Chowringhee More,"Chowringhee More, Adsr Mulazore East Ghosgpara Road, PS Jagaddal, Shyamnagar, West Bengal, 743127",9582610184,5.0,387
Diamond Harbour Road,"Premises No 72, Ward No 13, Diamond Harbour Road, Opposite Diamond Harbour Police Station, Madhabpur, Kolkata, West Bengal, 743331",9582497313,5.0,408
Perambur Moolakadai,"No 14, Madhavaram High Road Sembiam, Moolakadai, Perambur Road, Madhavaram, Opposite Simpon Gate No 1, Chennai, Tamil Nadu, 600011",8929328704,4.9,1985
Iyer Bungalow,"Jaya Complex, 2/1121, 1St Floor, Natham Road, Madurai, Opposite To Bus Stop, Madurai, Tamil Nadu, 624014",8588908166,4.9,1091
Selaiyur,"27, Agaram Main Road, Ranganatha Nagar, Selaiyur, Chennai, Tamil Nadu, 600073",9319375434,4.9,1595
Kandanchavadi,"New No 08, Old No 6/169 Mgr Main Road, Govindaswamy Nagar 5Th Street, Kandanchavadi, Next To Gem Hospital, Chennai, Tamil Nadu, 600096",7065043626,5.0,1289
"Ashok Nagar, Chennai","Shop No 38 (Old) 60 (New), Ground Floor, Jai Durga Apartment, Ashok Nagar, Chennai, Hot Chips, 1St Avenue, Chennai, Tamil Nadu, 600083",7428891139,4.9,1923
Chengalpet,"No 11, Joesph Towers, Gst Main Road, Alagesan Nagar Extention, Chengalpet, Opposite Reliaince Trends, Kanchipuram, Tamil Nadu, 603001",9319373471,4.9,824
Shalimar Gateway Mall Alambagh,"16 Ground Floor, Shalimar Gateway Mall, Alambagh, Beside Alambagh Bus Stand, Lucknow, Uttar Pradesh, 226005",8929277343,4.9,514
Hapur,"2423, Ground Floor, Nehru Chowk, Atarpura, Garh Road, Hapur, Uttar Pradesh, 245101",9999203861,4.9,557
Kidwai Nagar,"133/155, M Block, Kidwai Nagar, Beside Bank Of Baroda, Kanpur, Uttar Pradesh, 208011",8929276286,4.7,390
Kamla Nagar,"32A/B71, 1St Floor, Semi Basement, Central Bank Road, Kamla Nagar, Agra, Uttar Pradesh, 282005",8929306428,4.9,883
Mahagun Mart Shopping Complex,"Shop No 48, Plot No Gh04, , Mahagun Mart Shopping Complex, Gaur City 2, Greater Noida West, Noida, Uttar Pradesh, 201301",7428891333,4.8,970
Nivedita,"Nivedita Road, Ward 2, Pradhan Nagar, Near ICICI Bank, Siliguri, West Bengal, 734001",9643859869,5.0,288
Naktala,"Shop No 237, Netaji Subhash Chandra Bose Road, Naktala, Kolkata, West Bengal, 700047",9582181507,4.9,1136
Jalpaiguri,"Ward No 07, Shop No B, Ground Floor, Thana More, Jalpaiguri, West Bengal, 735101",9818348349,4.8,570
Kadamtala,"9 Kedarnath Mukherjee Lane, Kadamtala, Howrah, West Bengal, 700001",9582950938,4.9,2191
Gopalpur,"Ground Floor Block B, New Town Metro Plaza, Mouza Atghora, P S Rajarhat Road, District North 24 Parganas, Gopalpur, Kolkata, West Bengal, 700136",8743812052,4.9,943
Barrackpore,"No 12, Ground Floor, Suryatapa Apartment, S N Banerjee Road, Chiria More, Near Barrackpur Chiria More, Barrackpore, West Bengal, 700120",8447923983,4.9,1309
Simmakkal,"109, Vakkilnew Street, Northmart Street, Madurai Main, Madurai, Opposite Simmakkal Bus Stand, Madurai, Tamil Nadu, 625001",8447822737,4.9,1066
Urapakkam,"Urapakkam Flyover, Sri Balaji Nagar, Urapakkam, Perungalathur, Urapakkam, Chennai, Tamil Nadu, 603211",8447745638,4.9,1048
Thiruvottiyur,"Shop No 93, Ssm Complex, Rajakadai, Thiruvottiyur, Opposite Rohit Hospital, Chennai, Tamil Nadu, 600019",7428891142,4.9,1840
Velachery,"No 26, 15/17A, Velachery Bypass Road, Rajalakshmi Nagar, Velachery, Chennai, Tamil Nadu, 600042",8447804958,4.9,1292
Aminjikarai,"Old # 295, New # 507, Ph Road, Aminjikarai, Chennai, Tamil Nadu, 600029",8929182172,4.9,1369
Fatehabad Road,"Groud Floor, Khasra No 1079 ,1375, & 1374, Mouza Basai Mustakil Tehil District, 30/6/20, K/1, Gower Chowki, Fatehabad Road, Agra, Uttar Pradesh, 282001",8743842745,4.9,315
Saket Nagar,"127/1/65, W1, Saket Nagar, Juhi, Kanpur, Uttar Pradesh, 208014",9953924292,4.9,159
Flagship Store Great India Place Mall,"Shop No 46, 47, Ground Floor, Sector 38, Great India Place Mall 2, Opposite Tanishq, Noida, Uttar Pradesh, 201301",7428891344,4.7,890
Sector 122,"Block CM 024, Sector 122, Noida, Uttar Pradesh, 201316",9953848479,5.0,198
"Atta Market, Sector 18, Noida","G6 & G6A, Ground Floor, Jop Plaza, , Atta Market, Sector 18, Next To Metro Station Gate No 2, Noida, Uttar Pradesh, 201301",7428891023,4.7,1510
Batanagar,"Ground Floor, House No B1 70/A/63, Budge Trunk Road, Jagtala Bata More, Batanagar, Near Batanagar Great Eastern, Kolkata, West Bengal, 700141",8447920573,4.9,966
Court More Asansol,"Nitesh Keshri, Burnpur Road, Court More Main Road, Apcar Garden, Near Medplus, Asansol, West Bengal, 713304",9953831996,4.9,462
Dagapur,"1st Floor, RS Plaza, Shalbari, Dagapur, Siliguri, West Bengal, 734009",9953825198,4.8,157
CIT Road,"116, Ground Floor, Dr. Sundari Mohan Avenue, Cit Road, Near Icici Cit Road Branch, Kolkata, West Bengal, 700014",9971001474,4.9,1751
Flagship Store Behala Chowrasta,"622, Diamond Harbour Road, H Road, Behala Chowrasta, Adjacent D Traffic Guard Office, Kolkata, West Bengal, 700008",8447917356,4.9,1996
Singaperumal Koil,"9/6, Gst Road, Periyar Street, Periya Vinjiyam Bakkam, Singaperumal Koil, Opposite Icici Bank, Chennai, Tamil Nadu, 603204",8447913903,4.9,943
West K K Nagar,"Shop No 1069, Munusamy Salai, West K K Nagar, Next To Puducherry Guest House, Chennai, Tamil Nadu, 600078",7428890083,4.8,1203
Tirumullaivoyal,"No 62/1, Cth Road, Near Ss Briyani, Thirumullaivoyal, Opposite Indian Bank, Chennai, Tamil Nadu, 600062",8929435405,4.9,1219
kavundampalayam,"14, Mettupalayam Main Road, Jayathi Nagar, Kavundampalayam, Coimbatore, Tamil Nadu, 641030",8929261370,4.9,960
Race Course Road,"Door No 86, Rathinam Circle View Building, Race Course Road, Coimbatore, Tamil Nadu, 641018",8447912932,4.9,1086
Abu Lane,"Ground Floor, C313, Abu Lane, Meerut, Uttar Pradesh, 250001",8447727685,4.7,565
Lajpat Nagar,"Ground Floor, Plot No 120/852, Narainpurwa, Lajpat Nagar, Kanpur, Uttar Pradesh, 208012",8447893843,4.9,635
Tara Mandal,"12-B, Buddh Vihar Colony, Tara Mandal Bypass Road, Opposite GDA Office, Gorakhpur, Uttar Pradesh, 273107",9953709749,4.9,294
"Sector 12, Vasundhara","Plot No 506, Ground Floor, Sector 12, Vasundhara, Opposite Sunrise Mall, Ghaziabad, Uttar Pradesh, 201012",7428891374,4.8,828
Basharatpur,"UGF, JP Complex, Plot No 281A, Basharatpur, Near Passport Office, Gorakhpur, Uttar Pradesh, 273004",8929608628,4.9,896
Junction Mall,"Shop No Ug 09, Ground Floor, Harekrishna Konar Sarani, Junction Mall, Near Citi Residency, Durgapur, West Bengal, 713216",7428891356,4.9,1519
Bidhan Nagar,"DD7, DD Block, Sector 1, Bidhannagar, Saltlake ILS Hospital, Near City Centre 1 Mall, Kolkata, West Bengal, 700064",8744060717,4.9,1235
Malda Town,"28/33, Kj Sanyal Road, Po, Kj Sanyal Road, Near North Bengal Nursing Home, Malda Town, West Bengal, 732101",8826001362,4.9,1588
Uluberia,"Upper Floor, JL No 86, Near Sun Hospital, P S Uluberia, Howrah, West Bengal, 711316",9899410236,4.9,671
Naihati,"231, Rishi Bankim Chandra Road, Gowalapara Ghat, Naihati, Kolkata, West Bengal, 743165",8447806693,4.9,1829
Sakher Bazaar,"5B Diamond Harbour Road, Chowrasta, Purba Barisha, Silpara, Beside Sakherbazaar Behala, Kolkata, West Bengal, 700008",9582946566,4.9,1953
Fairlands,"17/21, Ground Floor, Brindavan Road, Fairlands, Near Sarada Vidyalaya School, Salem, Tamil Nadu, 636016",7428890085,4.9,2056
"Phoenix Market City Mall, Velachery","Shop No 142, 1St Floor, Phoenix Market City Mall, Velachery, Next To Raymonds Showroom, Chennai, Tamil Nadu, 600042",7428891148,4.9,3021
RS Puram,"Shop No. 581/1, Db Road, Rs Puram, Near Eye Foundation, Coimbatore, Tamil Nadu, 641002",7428890097,4.8,2334
Rajakilpakkam,"Shop No 31, Plot No 1, Sembakkam, Mgr Street, Rajakilpakkam, Near To New Life Hospital, Chennai, Tamil Nadu, 600073",7428891150,4.9,2985
Ambedkar Road,"Ssa Arcade, 10/1, Ground Floor, Dr Ambedkar Road, 4Th Avenue, Ashok Nagar, Opposite Thick Shake Factory, Chennai, Tamil Nadu, 600083",8929033731,4.9,2766
Civil Lines,"Lg 4, Lower Ground Floor, Ram Raghu Palazzo, Church Road, Civil Lines Village Sarjepur, Civil Lines, Agra, Uttar Pradesh, 282002",8447731781,4.9,822
Shahjahanpur,"Nath Tower, Tareen Bahadur Ganj, Near Ghantaghar, Shahjahanpur, Uttar Pradesh, 242001",8929342372,4.9,551
Swaroop Nagar,"Shop No G8 & G9, Ground Floor, House No 7/118, Tulsa Complex, Swaroop Nagar, Kanpur, Uttar Pradesh, 208002",8447745038,4.7,666
Sikandara,"Shop No 3, Ground Floor, Crossroads Mall, Bodla Road, Sikandra, Agra, Uttar Pradesh, 282007",8929598410,4.9,315
Hazratganj,"Shop No 4,5,6, Gobind Ram Son'S, Besides Marksmen Restaurant, Hazratganj, Besides Marskmen Restaurant, Lucknow, Uttar Pradesh, 226001",9643241384,4.9,5590
"Barasat, Champadali","Lake View Apartment, 75/1 / A & B Jessore Road, Sethpukur, Barasat, Near Sethpukur Athletic Club, Kolkata, West Bengal, 700124",8929688278,4.9,3327
Burdwan,"No 1 Officers Colony, G T Road, Parbirhata Branch, Po Sripally, Near State Bank Of India, Burdwan, West Bengal, 713103",9999213835,4.9,1874
Tollygunge,"Shop No 39/1B, Tollygunge, Opposite Ashok Nagar Park, Kolkata, West Bengal, 700040",7428891063,4.9,2026
Shakespeare Sarani,"3A, Ground Floor, Shakespeare Sarani, Near Ac Market, Kolkata, West Bengal, 700071",7042881388,4.9,1326
Vega Circle Mall,"2Nd Floor, Vega Circle Mall, Siliguri, Vega Circle Mall, Siliguri, West Bengal, 734008",8447807829,4.9,994
RS Puram,"No 121 Tv Swamy Road, West Rs Puram, Opposite Krs Bakery, Coimbatore, Tamil Nadu, 641002",9319369325,4.9,1258
Flagship Store Avadi,"210, Nehru Bazar, Ph Road, Avadi, Near Chinnamman Temple, Chennai, Tamil Nadu, 600054",8447820963,4.9,1232
"Pallavaram Market, Chennai","# 8/14, Indira Gandhi Road, C Pallavaram, Chennai, Tamil Nadu, 600043",9540845413,4.9,1135
Tirunelveli,"55 C, 22, 23 High Road, Raja Building ,Opposite Old Bus Stand, 55 C, 22, 23 High Road, Raja Building, Tirunelveli, Tamil Nadu, 627001",8447732706,4.9,920
Ganapathy,"No 328, Sathy Road, Athipalayam Pirivu, Prashakthi Nagar, Ganapathy, Ganapathy, Opposite Shiva Hospital, Coimbatore, Tamil Nadu, 641006",8929270459,4.9,503
Gugai,"807 Resurvey Ward No 3, Old TSN, Ground, First & Second Floor,No 132/13, Sankari Main Road, Thathagaapatti, Gugai, Near Prabatha Signal, Salem, Tamil Nadu, 636006",9873692782,4.9,2281
Logix Mall,"Shop No 10, Ground Floor, Plot No Bw 58, Logix City Center Mall, Sector 32, Opposite Haldiram'S, Noida, Uttar Pradesh, 201301",8588911397,4.8,1021
"KW Mall, Rajnagar Extension","Shop No 48,49,50,51,52, Upper Ground Floor, KW Mall Delhi 6, Raj Nagar Extension, Ghaziabad, Uttar Pradesh, 201017",8505956743,4.9,511
Samridhi Grand,"Shop No 9, Ground Floor, Samridhi Grand Avenue, Techzone 4, Greater Noida, Uttar Pradesh, 201305",9953596781,5.0,129
Sector 50,"Shop No B 1/50, , Sector 50, Noida, Near Noida Sector 50 Market, Noida, Uttar Pradesh, 201301",7428891081,4.8,1528
Telibagh,"Ground Floor, 587/018, Raibareli Road, Telibagh, Lucknow, Uttar Pradesh, 226002",9873976048,4.9,111
Flagship Store Gariahat,"14/6, Gariahat, Gariahat Road, Opposite Gariahat Pantaloons, Kolkata, West Bengal, 700019",8826671645,4.9,1707
Chinsurah,"21/152 Opposite Of Maitri Diagnostic, Hospital Road, Ankhan Bazar, Chinsurah, Near District Hospital, Hooghly, West Bengal, 712105",7428890078,4.9,810
Avani Riverside Mall,"Shop No 11, Ground Floor, Avani Mall, 32 Jagat Banerjee Ghat Road, Opposite Pantaloons, Howrah, West Bengal, 711102",9582701393,4.4,325
Salt Lake,"Shop No Bf/21, Sector 1, Cap Camp Island, Salt Lake, Beside Indusind Bank, Kolkata, West Bengal, 700091",7428891083,4.9,1023
"Barasat Road, Barrackpur","Ward No 7, Barasat Road, Nona Chandanpukur, Barrackpore, Kolkata, West Bengal, 700122",9582317607,4.9,368
Habra,"Jessore Road, P.S Habra, Jessore Road, Near Joygachi, Habra, West Bengal, 743263",8929289724,4.9,1507
Navalur,"Shop No 22, Rajiv Gandhi Salai, Navalur, Kanchipuram, Opposite Ags Cinemas, Chennai, Tamil Nadu, 603103",7428891158,4.9,2200
Sitara Coimbatore,"# 35/2, Avinashi Road, Near KMCH Hospital, Sitara, Coimbatore, Tamil Nadu, 641014",4222993569,,0
Besant Nagar,"11, Annai Velankani Road, Ashtalakshmi Garden, Besant Nagar, Chennai, Next To Axis Bank, Chennai, Tamil Nadu, 600090",9910380381,4.9,1452
Mowlivakkam,"5C, 212, Kundrathur Road, Moulivakkam, Chennai, Tamil Nadu, 600125",8447806514,4.9,1123
Karaikkal,"#156, Bharathiyar Road, Karaikal, Puducherry, Tamil Nadu, 609602",4368293439,5.0,15
Madhanandapuram,"No 112, Mugalivakkam Main Road, Santhosh Nagar, Madhanandapuram, Chennai, Tamil Nadu, 600125",8929265275,4.9,538
Perungudi,"48, 4, Old Mahabalipuram Road, Tirumalai Nagar, Perungudi, Next To World Trade Centre, Chennai, Tamil Nadu, 600096",7303238239,4.9,2013
Supertech North Eye,"Shop No 0005 & 0006, Ground Floor, East Wing Supertech North Eye, GH-01/A, Sector 77, Noida, Uttar Pradesh, 201301",9873967136,4.9,115
Gaur City Mall,"Shop No 10, First Floor, Gaur City Mall, Plot No C-01B-Gh-01, Sec 4, Char Murti Chowk, Greater Noida, Greater Noida, Uttar Pradesh, 201301",8929421380,4.8,1210
Chi V,"Shop No 07, Ground Floor, The Park Street, Express Park View Ii, Plot No Gh 03, Sector Chi V, Gautam Buddha Nagar, Sector Chi V, Greater Noida, Uttar Pradesh, 201310",7065045092,4.9,713
Kalikapur,"904, Purbachal Road, Kalikapur, Opposite Florence, Kolkata, West Bengal, 700078",8447731071,4.9,1080
"MG Road, Kolkata","Shop No 150, Poddar Chhatra Niwa, Cr Avenue, Mg Road, Near Mg Road Metro Station Gate No 1, Kolkata, West Bengal, 700007",7428891089,4.9,3239
Tobin Road,"Shop No 274, Bimala Udyog, Bt Road, Baranagar, Tobin Road, Near Bharat Petroleum Petrol Pump, Kolkata, West Bengal, 700036",7428891090,4.9,2416
Cooch Behar,"130, Nipendra Narayan Road, Beside Idbi Bank, Cooch Behar, West Bengal, 736101",8929695159,4.9,591
New Alipore,"Shop No 77 B, Ground Floor, Vrindavan Bhavan, Block E, New Alipore, Opposite Taj Paharpur Apartments, Kolkata, West Bengal, 700053",7428891091,4.8,2127
Forum Rangoli Mall,"Su 043, Ground Floor, Rangoli Mall 212, Girish Ghosh Road, Howrah, Belur Math Temple, Kolkata, West Bengal, 711202",9582981406,4.9,4949
Karayanchavadi,"Ground Floor, Dj Complex, 52 Trunk Road, Karayanchavadi, Poonamalle, Chennai, Tamil Nadu, 600056",9582511445,4.9,1357
Mount Road,"No 117/2, Mount Road, Anna Salai, Next To Sangam Hotel, Chennai, Tamil Nadu, 600002",8929338696,4.9,1058
Porur Arcot Road,"3, Arcot Road, Sai Nagar, Porur Arcot Road, Next To Sony Centre, Chennai, Tamil Nadu, 600116",9319374288,4.9,1261
Salem,"No 423, Jaguar Ammapalayam Kasakaranoor, Junction Main Road Salem, Opposite Sona Salem College, Salem, Tamil Nadu, 636005",8447731085,4.9,1665
Krishnagiri,"1/374-1, Rajaji Nagar, Rayakottai Road, Rajajinagar, Opposite Rbl Bank, Krishnagiri, Tamil Nadu, 635001",8447732701,4.9,727
Trichy Karur Bypass Road,"11, Mc Arcade No 9, Karur Bypass Road, Annamalai Nagar, Next To Benelli Bike Showroom, Tiruchirappalli, Tamil Nadu, 620018",9319374190,4.9,1424
Khardah,"Shop B, Neelanchal Apartment, Station Road, Rahara Bazaar, Khardah, Beside Chitrachaya Studio, Kolkata, West Bengal, 700118",7428891092,4.9,1614
Serampore,"Shop No 61, Ground Floor, Grand Trunk Road, Serampore, Near Kalitala, Hooghly, West Bengal, 712409",7428891093,4.9,2101
Rampurhat,"Ward No 07, 528/10/1, D B Road, Kamarpatty, Kamarpatty, Near Khadim'S Showroom, Rampurhat, West Bengal, 731224",8826653375,4.9,1991
Uttarpara,"Shop No 39, New Gt Road, Uttarpara, Near Tiptop Bus Stand, Kolkata, West Bengal, 712258",7428891094,4.9,2299
Maslandapur,"Tentuliya Road, Block Habra, Maslandapur, Kolkata, West Bengal, 743289",9953799187,5.0,273
Nager Bazar,"No 153/1, Shop No 4, Baisakhi Building, No 217, Jessore Road, Nagerbazar, Near Diamond Plaza Mall, Kolkata, West Bengal, 700074",7428891096,4.9,1425
Kilpauk,"62C, Ormes Road, Kilpauk, Next To Orms Junction, Chennai, Tamil Nadu, 600010",8588808657,4.8,965
Madipakkam,"Shop No 3, Medavakkam Main Road, Madipakkam, Below Indian Bank, Chennai, Tamil Nadu, 600091",7428891181,4.9,1745
Ramanathapuram,"1114 B, Sungam, Ramanathapuram, Trichy Road, Sungam, Coimbatore, Tamil Nadu, 641045",8929121766,4.9,1134
"Pallavaram 200Ft Road, Chennai","Survey No 257/4-B, Zamin Pallavaram, 200ft Radial Road, Taluk Tambaram, District Kancheepuram, Chennai, Tamil Nadu, 600044",9582386812,4.9,1507
Flagship Store at Adyar,"Shop No 57, Kg Vallencia, First Main Road, Gandhi Nagar, Adyar, Opposite Ramkey Tvs, Chennai, Tamil Nadu, 600020",7428891182,4.9,2623
Porur,"23, Trunk Road, Jaya Nagar, Porur Junction, Chennai, Tamil Nadu, 600116",8929341371,4.8,1088
Pattambi,"SY No 69-7/5 Of Vattakavu Padivattom, Southern Side Of Kudiyirippu Parambu, Next To Koppans Mall, Ponnani Road Village, Pattambi, Thrissur, Kerala, 67",7291816912,5.0,480
Wadakkanchery,"Ground Floor, Meenu Mart Building, Ottupara, Wadakkancherry, Opposite Relief Medical, Thrissur, Kerala, 680582",8743098291,4.9,366
Chalakudy,"Door # 278H/278I, Maria Majestic, Ccmk Junction, Chalakudy, Opposite Esaf Bank, Thrissur, Kerala, 680307",8929331602,4.9,998
Jadavpur,"Ananda Pally, Bapuji Nagar, Jadavpur, Kolkata, West Bengal, 700032",9810331506,4.9,1623
Madhyamgram,"Shop No 584/4, Sodepur Barasat Road, , Madhyamgram, Opposite Kalyan Market, Kolkata, West Bengal, 700129",7428891099,4.8,933
Valasaravakkam,"Shop No 173, RA Complex, Arcot Road, Opposite Idfc First Bank, Valasaravakkam, Chennai, Tamil Nadu, 600087",7428891183,4.9,2888
Oggiyamduraipakkam,"Plot No 6, 200 Ft Radial Road, Sai Nagar, Toll Plaza Thoraippakkam, Sai Nagar, Chennai, Tamil Nadu, 600097",7838290305,4.9,1781
Flagship Store Madipakkam,"No 11, Madipakkam, Main Road Kaiveli, Velachery, Opposite Barath Petrol Bunk, Chennai, Tamil Nadu, 600042",8929342519,4.9,1640
Perambur,"Shop No 68, Ground Floor, Paper Mills Road, Perambur, Near Perumbur Church, Chennai, Tamil Nadu, 600011",8800442742,4.9,4164
Kalavasal Bypass Road,"P T R Complex, No 56, Kalavasal Bypass Road, Kalavasal, Madurai, Tamil Nadu, 625010",8929266318,4.9,1493
Irinjalakuda,"Vellanikaran Building, Irinjalakuda Main Road, Irinjalakuda, Opposite Govt Model Boys Higher Secondary School, Thrissur, Kerala, 680121",8447895875,4.8,581
Thrissur,"Ground Floor, Vijaya Towers, Keerankulangara, Palakkad Road, Near St Thomas College, Thrissur, Kerala, 680001",8130347348,4.9,3485
Poothole,"Akm Complex, Sankarayya Road, Railway Station Road, Kuttipuzha Nagar, Poothole, Thrissur, Kerala, 680004",8447810174,4.8,3244
Chavakkad,"KK Mall, North Bypass Road, Chavakkad, Thrissur, Kerala, 680506",8742926805,4.8,280
Kunnamkulam,"Shop No 1, Municipal Shopping Complex, Kunnamkulam, Opposite HP Petrol Pump, Thrissur, Kerala, 680503",7428890245,4.9,867
Mettupalayam,"No 117, Karamadai Road, Coimbatore Main Road, Near Axis Bank, Mettupalayam, Tamil Nadu, 641301",9654436416,4.9,885
Moggapair West,"Pc 2/6, Second Block, Moggapair West, Near Bharat Petroleum Petrol Pump, Chennai, Tamil Nadu, 600037",7428891190,4.8,1329
Omalur Salem,"No 79/1, Andavar Complex, Near Bus Stand, Omalur, Salem, Tamil Nadu, 636455",8971437396,,0
Tirupattur,"N0 50, Palanisamy, Road, Opposite Indian Oil Petrol Pump, Tirupattur, Tamil Nadu, 635601",8929337341,4.9,527
Gandhi Nagar,"Shop No 29/15, Jayliz Junction, Azad Road, Gandhi Nagar, Aravind Eye Hospital Road, Gandhi Nagar, Near Anna Bus Stand, Madurai, Tamil Nadu, 625020",8527615333,4.8,810
Kolathur,"No 66 & 67, Sivanandha Nagar, 200 Feet Road, Kolathur, Kolathur, Near Sendhil Nagar Bus Stop, Chennai, Tamil Nadu, 600099",9319359741,4.9,2563
Flagship Store at Thuraipakkam,"Shop No 5/351, Omr Road, Okkiyampettar, Thuraipakkam, Opposite Indian Oil Petrol Pump, Chennai, Tamil Nadu, 600097",7428891200,4.9,1731
"Tambaram MEPZ, Chennai","TJP Complex, GST Road, Tambaram Sanatorium, Tambaram, Chennai, Tamil Nadu, 600045",8929341351,4.9,1010
West Mambalam,"Shop No 37/B, Aryagowda Road, Postal Colony, West Mambalam, Opposite West Mambalam Post Office, Chennai, Tamil Nadu, 600033",7428890159,4.9,1887
Sulur,"3 & 4A, Ground Floor, Sri Ramana Complex, Trichy Road, Sulur, Near Rvs College Arts & Science, Coimbatore, Tamil Nadu, 641402",8929442492,4.9,1544
Marthandam,"Block 2, 2 63 E, C P Sons Complex, Ammankoil, Marthandam, Kanyakumari, Tamil Nadu, 629165",8447745287,4.9,592
Anuparpalayam,"No 3, Avinashi Road, Gandhi Road Junction, Anupparpalayam, Tiruppur, Tamil Nadu, 641652",9582546056,4.9,489
Anna Nagar,"No 335 1, 80Ft Road, Anna Nagar, Sathamangalam, Anna Nagar, Near Hdfc Bank, Madurai, Tamil Nadu, 625020",8929340330,4.9,2262
Saidapet,"Old No 118, New Door No 16, Bazzar Road, Saidapet, Chennai, Tamil Nadu, 600015",8929346562,5.0,2274
RK Mutt Road,"234, Rk Mutt Road, Mylapore, Mylapore, Chennai, Tamil Nadu, 600004",8447822476,4.9,1385
Sivakasi,"Ts No 5/63, Babuji Complex, Gandhi Road, Parapatti, Sivakasi, Tamil Nadu, 626123",9873029640,4.9,1188
Nethaji Road,"9-C Nethaji Byepass Road, Hotel Agarwal Bavan Building, Next to DDCC Bank, Dharmapuri, Tamil Nadu, 636701",9654090185,4.9,1585
Thillai Nagar,"Store No A5, Passport Office Building, Shastri Road, Thillai Nagar, Megastar Cinema, Tiruchirappalli, Tamil Nadu, 620018",7428890186,4.9,1865
"Katpadi, Vellore","Shop No 1, Gds Complex, Green Circle, New Katpadi Road, Katpadi, Opposite New Bus Stand, Vellore, Tamil Nadu, 632004",7428890190,4.9,1895
Avinashi Road,"Shop No 441, Peelamedu, Peelamedu, Opposite Sms Hotel, Coimbatore, Tamil Nadu, 641004",7428890191,4.9,1828
Kalavasal Junction,"100, Next to Westside Showroom, Kalavasal Junction, Theni Road, Madurai, Tamil Nadu, 625016",7291806856,,0
Keelkattalai,"#100, Ground Floor, Medavakam Main Road, Keelkattalai, Chennai, Tamil Nadu, 600117",9873091465,4.9,1600
"MKB Nagar, Chennai","No 22, Kambar Street, Vivekananda Nagar, Mkb Nagar, Kodungaiyur, Opposite Hp Petrol Pump, Chennai, Tamil Nadu, 600118",8447743721,4.9,1668
Hastinapuram,"52, Dr Rajendra Prasad Road, Kumudham Colony, Nehru Nagar, Hastinapuram, Chromepet, Chennai, Tamil Nadu, 600064",8929338318,4.9,1387
Injambakkam ECR,"Plot B, Survey No 56/1A Ground Floor, Promenade Sh49, Ecr Injambakkam, Opposite Vgp, Chennai, Tamil Nadu, 600115",8929165514,4.9,697
Thillai Nagar,"31/1, Thillai Nagar 1-24, 3Rd Cross, Tiruchirapalli, Tamil Nadu, 620018",9899409505,4.9,495
Chinmayanagar,"Survey No 102, Patta No 74, 104, Kaliamman Koil St, Virugambakkam, Chinmayanagar, Chennai, Tamil Nadu, 600092",9582549032,4.9,948
Kanchipuram Nambi Street,"Ground Floor No 31, Thirukachi Nambi Street, Near Pachaiyappa's Women College Bus Stop, Kanchipuram, Tamil Nadu, 631501",9873804831,4.9,1225
Nelson Manickam Road,"154/24 A, Nelson Manickam Road, Metha Nagar, Near Shobhan Babu Statue, Chennai, Tamil Nadu, 600029",8929341301,5.0,1835
