location,address,phone_number,ratings,ratings_count
Indiranagar 2,"Shop No 483, Signature Square, 100 Feet Road, Indiranagar, Near Pizza Hut, Bengaluru, Karnataka, 560038",7428891266,4.8,1411
Infantry Road,"Plot No 15, Ground Floor, Infantry Road, Near Vasavi High School, Ballari, Karnataka, 583101",7428890235,4.9,2477
RR Nagar,"1163, Nehru Road, Beml 3Rd Stage, Rajarajeshwari Nagar, Bengaluru, Karnataka, 560098",7065264576,4.9,1102
Bhajanpura,"F 398, Ground Floor, Khajoori Khas, Main Wazirabad Road, Bhajanpura, New Delhi, 110094",8929277897,4.9,441
Ashok Vihar,"119 A, Deep Enclave, Phase 3, Near Ambedkar Chowk, Ashok Vihar, Delhi, 110052",8130101670,4.9,720
Lulu International Shopping Mall,"34/1000, Shop No 45 & 46, Second Floor, Nh 47, Edapally, Lulu International Shopping Mall, Kochi, Kerala, 682024",7428891302,4.6,1267
Valanchery,"VPIII/217, Kohzikode Road Valanchery, Malappurram, Kerala, 676552",8743802947,4.9,1563
Kunnamangalam,"Devas Building, Door No 20/180/B2 & B3, Karanthur Po Kunnamangalam, Kunnamangalam, Near Markaz College Main Gate, Calicut, Kerala, 673571",8929437630,4.9,1187
Chalakudy,"Door # 278H/278I, Maria Majestic, Ccmk Junction, Chalakudy, Opposite Esaf Bank, Thrissur, Kerala, 680307",8929331602,4.9,998
Thamarassery,"Ground Floor, No 5/641 Kozhikode, Mysore Kollakkal, High Way Thamarassery, Thamarassey, Calicut, Kerala, 673573",9582955141,4.9,967
General Hospital Trivandrum,"Ground Floor, TC 82/2231, General Hospital Branch TVM, Deepa Arcade, Convent Road, Palayam, Opposite More Megastore, Thiruvananthapuram, Kerala, 695001",8588908367,4.9,1214
Junagadh,"Shop No G2, Ground Floor, Peri Plaza Complex, Sardar Bagh, Near Alkapuri Society, Junagadh, Gujarat, 362001",9643420312,4.5,148
Rushabh Char Rasta Adajan Patiya,"Shop No G/13, Sangini Magnus, Rushabh Char Rasta, Rander Road, Adajan Patiya, Opposite Rushabh Tower, Surat, Gujarat, 395009",8447745628,4.9,777
Maninagar,"Shop No1, Shreekar Avenue, Bairavnath Road, Maninagar, Maninagar, Ahmedabad, Gujarat, 380008",8447742650,4.8,788
Naranpura,"Shop No 5, Spenta 2 Buildings, Naranpura, Near Naranpura Police Station, Ahmedabad, Gujarat, 382170",8929276040,4.9,561
Sama,"Shop No 36 & 37, Ground Floor, Lotus Aura Final, Plot No 168, Village Mouje Sama, Sama, Near Ioc Petrol Pump, Vadodara, Gujarat, 390024",8929214932,4.9,934
Waghodia,"Ground Floor, Uma Complex, Uma Char Rasta, Uma Colony, Prabhat Nagar, Waghodia, Vadodara, Gujarat, 390019",7065286190,4.8,310
Shagun Chowk Pimpri,"Shop 1&2, Jai Govind Plaza, Shagun Chowk, Shastri Nagar, Pimpri Colony, Pimpri Chinchwad, Pune, Maharashtra, 411017",8929326687,4.9,579
"Sector 7, Airoli","Shop No G9, Shiv Shankar Plaza, , Sector 7, Airoli, Next To Domino'S Pizza, Navi Mumbai, Maharashtra, 400708",7428891243,4.6,769
"Sector 14, Koparkhairane","Shop No 3, Lotus Chs, Sector 14, Koparkhairane, Near D-Mart Chowk, Navi Mumbai, Maharashtra, 400709",7428890210,4.6,505
"Chandivali, Powai","Shop No 3, Lower Ground Floor, Wing C, Lake Primrose Commercial, Chandivali, Beside Lakme Salon, Mumbai, Maharashtra, 400076",7428891252,4.8,1511
Hiranandani Estate,"Shop No 4, Solus Office, Central Ave, Hiranandani Estate, West Thane, Maharashtra, 400607",8377005329,4.8,443
Lokhandwala Andheri West,"Shop No 9 &10, Benzer CHS Ltd, 8B, Main Road, Lokhandwala Complex, Andheri West, Mumbai, Maharashtra, 400053",9582605270,4.9,755
Ulwe,"Shop No 4, Shagun Essentia, Plot No 5, Sector 19, Ulwe, , Ulwe, Near Hdfc Bank, Navi Mumbai, Maharashtra, 410206",7838199672,4.7,647
Nigdi,"Shop No 5/6, Prestige Plaza, Old Mumbai Pune Highway, Nigdi, Pune, Maharashtra, 411335",7428890218,4.5,1313
Ballari,"Plot No 09, New Ward No 01, Parvathi Nagar, Ballari, Near Hdfc Bank, Ballari, Karnataka, 583103",7428890262,4.9,2034
Kuvempu Nagar,"Ground Floor, Asian Bussines Center, Kuvempu Nagar, Beside Asian Mall, Kalaburagi, Karnataka, 585102",7428890243,4.9,3210
Flagship Store at Banaswadi,"Shop No 19B, Ground Floor, Tamarind, 100 Feet Road, Banaswadi, Opposite Bata Showroom, Bengaluru, Karnataka, 560043",7428891283,4.7,1641
Heggannahalli,"No 170, Hegganahalli, Main Road, Vishwaneedam Post, Opppsite New Udupi Grand, Bengaluru, Karnataka, 560091",7428890264,4.9,910
Bhartiya City Mall,"Upper Ground Floor 35, Bhartiya City Mall, Chhokkanahalli Village, Yelahanka Hobli Bhartiya City, Thanisandra Main Road, Bengaluru, Karnataka, 560064",8743092780,4.8,284
Royal Meenakshi Mall,"Shop No S5, Second Floor, Bannerghatta Main Road, Royal Meenakshi Mall, Bengaluru, Karnataka, 560076",7428891286,4.8,1733
Ramamurthy Nagar,"Ground Floor, Chinnappa Layout, Main Road, Bovi Colony, Ramamurthy Nagar, Bengaluru, Karnataka, 560016",9319375299,4.9,652
Irinjalakuda,"Vellanikaran Building, Irinjalakuda Main Road, Irinjalakuda, Opposite Govt Model Boys Higher Secondary School, Thrissur, Kerala, 680121",8447895875,4.8,581
Thrissur,"Ground Floor, Vijaya Towers, Keerankulangara, Palakkad Road, Near St Thomas College, Thrissur, Kerala, 680001",8130347348,4.9,3485
Balaramapuram,"Block No13, Ward No 19, Inam Pandarapattam Desom Thalayal Fikra, Taluk Neyyatinkara, Balarampuram, Opposite Qrs, Thiruvananthapuram, Kerala, 695501",8447846876,4.9,645
Cherthala,"City Centre, North X-Ray Junction, Ac Road, Cherthala, Kerala, 688524",8929345325,4.9,2750
Sheetal Park Madhapar,"Shop No 4, Ground Floor, Time Square II, Sheetal Park, Ayodhya Chowk, 150 Feet Road, Madhapar, Rajkot, Gujarat, 360006",9643817450,4.9,171
Thaltej,"Shop No 4, Ground Floor, Dev Aditya Arcade, Thaltej, Shilaj Road, Near Bagban Partyplot, Ahmedabad, Gujarat, 380059",9319365261,4.9,844
Manjalpur,"Shop No 3,4 & 5, Ground Floor Tulsidham Co-Operative Housing Society Limited, Manjalpur, Near Khaki Kathiyawadi Thali, Vadodara, Gujarat, 390011",8130801618,4.8,1265
Sarthana,"Ground & First Floor, Shop No 01 & 101, Avadh Viceroy, Sarthana Jakat Naka, Kamrej Road, Subhash Nagar, Nana Varachha, Surat, Gujarat, 395006",7065038236,4.9,1387
City Light,"Ug 4, Ascon City, City Light, Opposite Maheshwar Bhavan, Surat, Gujarat, 395007",7428890053,4.9,941
Gandevi Road Navsari,"Shop No 3, Prem Nagar Society Jamalpore, Near Nilkanth Residency, Gandevi Road, Navsari Chhapra Part, Navsari, Gujarat, 396445",9643654314,5.0,106
Valsad,"Shop No 09, H No 2664/A-09, Pramukh Sanidhya, Abrama,Valsad, Gujarat, 396001",7065308772,4.9,151
"Flagship Store JM Road, Pune","Shop No 4, 99 Deccan Mall, Jm Road, Pune, Maharashtra, 411004",7838290571,4.5,1476
Nalasopara,"Shop No 22,23,24, Shalibadra Avenue, Nalasopara, Vasai, Link Road, Opposite life Care Hospital, Nalasopara Maharastra, 401208",9582622909,4.9,445
Sangli,"Shop No 1, Shri Laxmi Chembers, Beside Rajaram Sahakari Bank Ltd, Sangli, Maharashtra, 416416",8929338687,4.9,1195
Latur,"Shop 13, Municipal Shopping Complex, Gandhi Chowk, Latur, Maharashtra, 413512",8929335325,4.7,458
Dahisar,"Shop No 1&2, Manhar Residency, Kandarpada Circle, Opposite Hotel Majestic, Dahisar West, Mumbai, Maharashtra, 400068",8929172628,4.9,1819
Ganga Nagar,"Ground Floor, Ganga Nagar, Cbi Road, Hmt Layout, Hebbal, Opposite Shrine Of St.Jude Thaddeus Church, Bengaluru, Karnataka, 560032",9643381477,4.9,1802
Jigani,"No 49 1St Phase, Near Apc Circle, Bannerghatta Anekal Road, Jigani Industrial, Bengaluru, Karnataka, 560105",8929342533,4.9,1470
RMZ Galleria Mall,"Lower Ground Floor, Ambedkar Colony, Rmz Galleria Mall, Opposite Tanishq, Bengaluru, Karnataka, 560064",7428891292,4.9,1644
Singasandra,"A Block, Aecs Layout, Singasandra, Bengaluru, Karnataka, 560068",8929344659,4.9,1047
Flagship Store HSR Layout,"Shop No 16, 17Th Cross Road, 9Th Main, Sector 7, Hsr Layout, Behind Bda Complex, Bengaluru, Karnataka, 560102",7428891293,4.5,2376
JP Nagar,"No 301, E Block, JP Nagar, Layout Nachahalli, Khille Mohalla, Mysuru, Karnataka, 570008",9582612295,4.9,425
Ottappalam,"26/1414-1, Sn Arcade, Kulapulli Main Road, Ottapalam, Kerala, 679101",8376801137,4.9,1695
Adimali,"Kannattu Shopping Complex, Kallarkutty Road, Adimali, Idukki, Kerala, 685561",9953940273,4.7,13
Oberon Mall,"Shop No B1, Ground Floor, Oberon Mall, Nh Bypass Road, Edapally Ernakulam, Edapally, Oberon Mall, Ernakulam, Kerala, 682024",7303545546,4.8,619
Perinthalmana,"Myspex, Ekm Centre, Hospital Road, Perinthalmanna, Opposite Fire Station, Malappuram, Kerala, 679322",8447896134,5.0,1622
Mall of Travancore,"Shop No 2, Ground Floor, NH Bypass Service Road, Eanchakkal, Mall Of Travancore, Thiruvananthapuram, Kerala, 695024",7428891327,4.9,2396
L P Savani,"Shop No 6B, Shivalik Western, TGB, L P Savani Road, Adajan, Surat, Gujarat, 395009",8447805845,4.8,1554
Anand,"Shop No 1, Ground Floor, Hotel Sach Regency, Amul Dairy Road, Beside Amul Dairy Gate, Anand, Gujarat, 388001",8588808744,4.8,463
Himmatnagar,"Shop No 3&4, Ground Floor, Sv Complex, Sahkari Jin Road, Near Ananteshwar Mahadev, Himmatnagar, Gujarat, 383001",7065045203,4.7,396
Marol,"Shop No 5, Ground Floor, Radiant Tower 59, Marol Maroshi Road, Andheri East, Mumbai, Maharashtra, 400059",9582561743,4.8,190
Kausa Mumbra,"Shop No 15, Dost Apartment, Kausa Mumbra, Kausa, Besides Bank Of Baroda, Thane, Maharashtra, 400612",8447731483,4.8,691
Ganesh Mandir Road,"Shop No 1, Ground Floor, Mega Pearl, Next to Reliance Trends, Ganesh Mandir Road, Titwala, Maharashtra, 421605",9582958688,4.9,371
Mundwa Pune,"Shop No 21/4, Laxmi Park 4, Mundhwa Kharadi Road, Raghoba Patil Nagar, Sainath Nagar, Wadgoan Sheri, Pune, Maharashtra, 411014",9643654340,,0
MG Road Kandivali West,"Shop No 2 & 3 Burhani Heritage Chs Ltd, M G Road, Kandivali West, Opposite Bohra Masjid, Mumbai, Maharashtra, 400067",8929261281,4.9,813
Badnera Road,"Shop No 16 & 17, Swastik Sankul, Badnera Road, Nawathe, Near Hp Petrol Pump, Amravati, Maharashtra, 444607",7428890230,4.9,808
Flagship Store Doddakannahalli,"Shop No 121/3, Supreme Arcade, Sarjapur Road, Doddakannahalli, Next To Indian Oil Petrol Pump, Bengaluru, Karnataka, 560035",9654731294,4.7,2009
Flagship Store Jayanagar,"No 242/29, First Floor, Manandi Arch, 9Th Main Road, 3Rd Block, East Jayanagar, Jayanagar, Bengaluru, Karnataka, 560011",9811271534,4.8,1469
Udgir Road,"CMC No 8-9-448, Kamshetty Complex, Udgir Road, Bidar, Karnataka, 585403",7303815816,4.9,3315
Tilakwadi,"Shop No 1049/A/1, Swami Samarth Arcade, Khanapur Road, Tilakwadi, Near Datt Mandir, Belgaum, Karnataka, 590006",7428890256,4.9,2647
"Bhuvaneswari Nagar, Hebbal","Ground Floor, Siri Square 26, 4Th A Croos, Dasarahalli Main Road, Bhuvaneshwari Nagar, Hebbal, Bengaluru, Karnataka, 560024",7303577578,4.8,655
Perinthalmanna,"P M 4/5 15-5, Aydish Tower, Bypass Road, Malappuram, Perinthalmanna, Near Bismi Hypermarket, Perinthalmanna, Kerala, 679322",9650648649,4.9,2184
College Road,"Shop No 7/580, College Road, Opposite Pmg School, Palakkad, Kerala, 678001",7428890280,4.9,2696
Vazhuthacaud,"Springs Tc No 44/913, Ground Floor, Vazhuthacaud, Po Thycaud, Vazhuthacaud, Near Reliance Fresh, Thiruvananthapuram, Kerala, 695014",8929330380,4.9,1271
Payyanur,"Perumba SM Shopping Complex, Near KSRTC Stand, PO Payyanur, Kannur, Kerala, 670307",8512867793,4.9,1235
Koyilandi,"Amaal Tower, Room No Km 40/415 B 10 Nh, Koyilandy, Kozhikode, Kerala, 673305",8929436775,4.9,3025
Seaport Airport Road,"Seaport Airport Road, Judgemukku, Thrikkakara, Near Bharathmatha College, Kochi, Kerala, 682021",9999213876,4.9,2850
Navrangpura,"Ground Floor, Shop No 3, Glory Blossom Building, Hl College Road, Sabarmati Taluka, Sabarmati Taluka, Ahmedabad, Gujarat, 380009",8929267915,4.9,1762
Jamnagar,"Ward No 12, City Survey No 676, Sheet No 161, Keshav Complex, P N Marg, Opposite Dhanvantri Ground, Jamnagar, Gujarat, 361008",8929213223,4.8,1440
Waghawadi Road,"G5 Suvarnabhumi Heights, Opposite Honest Restaurant, Waghawadi Road, Bhavnagar, Gujarat, 364002",8929642251,4.8,430
Nizampura Vadodara,"Ground Floor, Shop No 104 & 105, Siddharth Crest Ii, Opposite HP Petrol Pump, Nizampura Main Road, Nizampura, Vadodara, Gujarat, 390024",9909045209,,0
VR Mall Surat,"Shop No 118, First Floor, VR Mall, Dumasa Road, Magdalla, Surat, Gujarat, 395007",8448431432,4.9,1484
Nikol,"Shop No 1 & 2, Devashya Status, Ankur Chokbi, New Colony, Bhakti Circle, Ahmedabad, Gujarat, 382345",9582470318,4.7,443
Valia Chokdi,"Plot No 155/C, Shop No 28-29-36-37, Omkar Complex 1, Valia Chokdi, Gidc, Anklesvar, Gujarat, 393001",8929440770,4.8,489
Shivaji Chowk,"Shop No 686 & 689, Shivaji Chowk, Ulhasnagar, Maharashtra, 421003",8744815912,4.9,386
Mira Road,"Antariksh Height, Shop No 2, Kanakia Road, Mira Road East, Opposite Kanakia Police Station, Mumbai, Maharashtra, 401107",8447705725,4.8,871
Manpada,"Shop No 2, Eucalyptus Apartment, Ghodbunder Road, Near Varun Garden, Manpada, Thane, Maharashtra, 400607",9582633686,4.9,229
"Marol, Andheri East","Shop No 1, 2, Raj Apartment, Military Road, Marol, Andheri East, Opposite Raj Industrial Complex, Mumbai, Maharashtra, 400059",7428891272,4.7,718
Parbhani,"34-112, Gavane Road, Gavane Road, Near Hotel Niraj, Parbhani, Maharashtra, 431401",8929174412,4.8,253
Pratapnagar Square,"Plot No 75, Narayan Sadan, Atre Layout, Ring Road, Near Pratap Nagar Square, Nagpur, Maharashtra, 440022",7428890236,4.7,1040
Goregaon West,"Shop No 4, Ashokraj Chs, S V Road, Goregaon West, Opposite Hirnen Shopping Centre, Mumbai, Maharashtra, 400062",7428891274,4.8,1875
Varsova Kabra Metro One,"Shop No 13, Kabra Metro One, Pratap Chs Ltd, J P Road, Versova, Andheri West, Varsova, Near Versova Metro Station, Mumbai, Maharashtra, 400058",7428891288,4.9,1666
Bagalur,"Ground Floor, 2Nd Cross, Bagalur Main Road, Vinayak Nagar, Kattigenahalli, Bagalur Main Road, Bengaluru, Karnataka, 560064",8587908848,4.9,1178
Davanagere,"Door No 2767, MCC B Block, 3Rd Cross, Davanagere, Karnataka, 577004",7303633634,4.9,2367
Koppikar Road,"Shop No 10, Ground Floor, Eureka Corner, Koppikar Road, Eureka Building, Hubli, Karnataka, 580020",7428890260,4.9,2457
Wilson Garden Road,"No 5 & Old No 165, 4Th Main, Wilson Garden Road, Wilson Garden, Beside Hotel Prashanth, Bengaluru, Karnataka, 560027",8929808984,4.8,782
Maruthi Nagar,"WJC7+897, Maruthi Nagar Main Road, Old Madiwala, Near More Supermarket, Chikka Madivala, 1st Stage, BTM Layout, Bengaluru, Karnataka, 560068",9643824565,4.8,67
KR Puram,"Ground Floor No 198/A, Shankar Mutt Road, Kr Puram, Kr Puram, Hassan, Karnataka, 573201",7303457458,4.9,6303
Randamkutty,"Block No 15 & Thandaper No 8270, Deepam Complex, Randamkutty, Kollam, Kerala, 691019",8742953692,4.9,2104
Poothole,"Akm Complex, Sankarayya Road, Railway Station Road, Kuttipuzha Nagar, Poothole, Thrissur, Kerala, 680004",8447810174,4.8,3244
Pathanamthitta,"Padippurayil Building Room No 29/404, 29/405, Opposite Punjab National Bank, Pathanamthitta, Kerala, 689645",8929706392,4.9,1666
Chanaganassery,"Perunna, Changanassery, Kottayam, Kerala, 686101",7291820701,4.9,453
KP Road,"Tc No 79/1322, Kowdiar Pattom Road, Kuravankonam, Near Supreme Bakery, Thiruvananthapuram, Kerala, 695004",8929289269,4.9,1012
Murinjapalam,"Tc 13/1670, Murinjapalam, Kumarapuram Road, Murinjapalam, Opposite Gg Hospital, Thiruvananthapuram, Kerala, 695011",8929344656,4.5,1182
Bopal,"Shop No 3, Shilp Aaron, Bhagwatikrupa Society, Bopal, Beside Bharat Petroleum Pump, Ahmedabad, Gujarat, 380058",7428891174,4.8,1038
Kalol,"Ground Floor, Shop No 62, City Mall 2, Navjivan Mill Compound, Vardhman Nagar, Kalol, Gujarat, 382721",9811039574,4.9,563
Shyamal,"Shop No 22, Iconic, Shyamal, Near Shyamal Cross Road, Ahmedabad, Gujarat, 380015",8929330698,4.9,1780
Bhayli,"Florence Excellence, Vasna Bhayli Road, Vadodara, Gujarat, 390015",8929125017,4.9,367
Anand Gujarat,"Shop No 15,, Hr Prime Building, Vidya Nagar, Near Gold Cinema, Anand, Gujarat, 388001",9643711455,4.7,944
Old Para Road,"Shop No 5, Ground Floor, Abhishek Complex, Old Para Road, Akshar Chowk, Vadodara, Gujarat, 390020",8929261831,4.9,1135
Ambegaon,"Shop No 56, Cafeteria 3, Aston Plaza, Narhe Ambegaon Road, Near Star Market, Ambegaon Budruk, Pune, Maharashtra, 411046",8744819602,4.7,478
Phadke Road,"Shop No 7A, 8-9, Janki Hari Chs, Phadke Road, Dombivli East, Thane, Maharashtra, 421201",9319360887,4.8,1388
Xperia Mall,"Shop No 1/29, First Floor, Dombivali East, Opposite Lodha World School, Mumbai, Maharashtra, 421204",7428891284,4.8,726
Salunkhe Vihar,"Unity Splendour Building, Salunkhe Vihar Road, Borade Nagar, Wanwadi, Salunkhe Vihar, Opposite Bank Of Maharashtra, Pune, Maharashtra, 411040",8929167669,4.6,350
Ashoka Marg,"SHop No 2, ABH Landmark, Ashoka Marg, Near Ashoka School, Kalpataru Nagar, Nashik, Maharashtra, 422011",9582893076,4.9,208
Basaveshwara Nagar,"#579, Shankari Avenue, Siddaiah Puranik Road, 3Rd Stage, 4Th Block, Basaveshwaranagar, Basaveshwaranagar Main Road, Bengaluru, Karnataka, 560079",9582670929,4.6,500
Nexus Shantiniketan,"Shop No 5, Lower Ground Floor, Nexus Shantiniketan Mall, Itpl Main Road, Opposite Manipal Hospital, Whitefield, Bengaluru, Karnataka, 560067",9643991310,4.7,1585
Dharwad,"No 494/B/16/G, G-1, Nh-4, Pb Road, Shivananda Nagar, Near Hubli Toll Naka, Dharwad, Karnataka, 580004",8929335375,4.9,2439
JP Nagar 8th Phase,"No 30/A 3Rd, Block Layout, Jp Nagar 8Th Phase, Jp Nagar, Near Vishal Mart, Bengaluru, Karnataka, 560076",8447914974,4.9,1006
Ayyapanagar,"#1 & 2, Surya Manson, Ayyappa Nagar, Kodigehalli Road, Krishnarajapura, Bengaluru, Karnataka, 560049",8512050875,4.9,1011
Nehru Nagar,"PB Road, Nehru Nagar, Mujawar Acrade, Belagavi, Karnataka, 590010",7291042630,4.9,496
"Flagship Store JP Nagar, 7th Phase","Shop No 17, Rbi Layout, , Jp Nagar, 7Th Phase, Karnataka Bank, 10Th A East Cross Road, Bengaluru, Karnataka, 560078",7428891314,4.8,2524
Ravipuram,"Door No 61 1800, Mg Road, Ravipuram, Atlantis Junction, Thevara, Ravipuram, Opposite Cochin Shipyard, Cochin, Kerala, 682015",8929328688,4.9,1310
Flagship Store Thiruvalla,"39/594-2, Ground Floor, Kunjancheril Building, M.C Road, Ramanchira, Opposite To Sbi Sme Branch, Ramanchira, Thiruvalla, Kerala, 689107",8800313356,4.8,3482
Thrippunithura,"Magna Business Centre, Sn Jn, Eroor Road, Thrippunithura, Opposite Lakshmi Ayurveda Hospital, Cochin, Kerala, 682301",9971223351,4.9,2348
Kollam,"Malabar Kiotchen Gallery, Eravipuram, Pallimuku Road, Vadakkevila, Near Malabar Kitchen Gallery, Kollam, Kerala, 691021",8929302362,4.9,2424
Kozhikode,"Shop No 62/931, Ground Floor, Citadel Arcade, Red Cross Road, Opposite Tagore Centenary Hall, Kozhikode, Kerala, 673032",9971133359,4.9,2620
Forum Mall,"Unit No 1F 103, 1st Floor, Forum Mall, NH 47, Vytilla Aroor Bypass, Near Kundannur Junction, Maradu, Kochi, Kerala, 682304",9582017077,4.9,442
Pappanamcode,"Block No 26, Muri/Kara Manukulathichamangalam, Karakkamandapam, Nemom, Thiruvananthapuram, Kerala, 695019",8929808677,4.9,807
Kovoor,"Essay Tower, Kovoor, Kozhikode, Kovoor, Near Medical College, Calicut, Kerala, 673008",7428890228,4.9,1171
"Science City Road, Sola","Shop No 01, Ground Floor, Royal Square, Science City Road, Sola, Opposite Coral Complex, Ahmedabad, Gujarat, 380060",7428891186,4.8,973
"Gurukul Road, Memnagar","Shop No 1, Shilp Complex, Gurukul Road, Memnagar, Opposite Oxford Tower, Ahmedabad, Gujarat, 380052",7428891192,4.8,1354
Nadiad,"Shop No 3, Gf, Sky Tatva, College Road, College Road, Opposite Ambashram, Nadiad, Gujarat, 387001",8929435320,4.8,366
Chandkheda,"Ground Floor, Shop No 1, Nakshatra Arcade, Iocl Road, Beside Apollo Pharmacy, Ahmedabad, Gujarat, 382424",8929340310,4.9,1659
Ambawadi,"Ground Floor, Shop No 7, Privera Complex, Nehrunagar Circle, Ambawadi, Ahmedabad, Gujarat, 382210",8929341311,4.9,1074
Maple Tree Ahmedabad,"Gf 32, Maple Tree, B/S Manichandra Bunglows, Surdhara Circle, Thaltej, Surdhara Circle Memnagar, Near Manichandra Bnaglow, Ahmedabad, Gujarat, 380059",9319364997,4.9,1586
Untwadi Road,"Shop No 1, Viraj Bhumi, Kankariya's, Near Croma Store, Untwadi Road, Nashik, Maharashtra, 422008",9582492402,4.9,102
Mumbai Central,"15, Ground Floor, B Wing, Santoshi Mata Chs, Dr Dadasaheb Bhadkamkar Marg, Near Saraswat Bank, Mumbai, Maharashtra, 400008",7428891037,4.9,1689
Growel Mall,"G 5A, Ground Floor, Akurli Road, Kandivali East, Growel Mall, Mumbai, Maharashtra, 400101",7428891291,4.9,1775
Nitin Company,"Nitin Company, Shop No 15 & 16, Prestige Garden, Almeda Raod, Ganeshwadi, Thane, Maharashtra, 400602",9873101538,4.8,788
Moshi,"Shop No 2 Kalmalraj, Central Dehu Alandi Road, Midc Moshi, Near Hdfc Bank, Pimpri Chinchwad, Pune, Maharashtra, 412105",9582433874,4.6,206
"Inorbit Mall, Vashi","Shop No F12, First Floor, Inorbit Mall, Vashi, Next To Vashi Station, Navi Mumbai, Maharashtra, 400705",7428891298,4.7,1093
Sultanpalya,"No 43, Shop No 1&2, Sultan Palya Main Road, Rt Nagar, Near Laxmi Gold Paradise, Bengaluru, Karnataka, 560032",8929328753,4.9,1052
Kuvempunagara,"Mig 2, Ground Floor, New Kantharaja Urs Road, Kuvempunagara, Near Sri S. Nijalingappa Circle, Mysuru, Karnataka, 570023",7428890271,4.9,7183
Lingad Gudi Road,"Parekh Arcade, Sharan Nagar, Lingad Gudi Road, Near Signature Mall, Bijapur, Karnataka, 586103",7428890272,4.9,2449
Magadi Road,"92, Magadi Main Road, Govindaraja Nagar Ward, Opposite Shell Fuel Station, Vijayanagar, Bengaluru, Karnataka 560040",9873906797,4.9,162
Mallathalli,"No 5 & 6, Gidada Konnenahalli, Muddinapalya Main Road, ITI Layout, Mallathalli, Bengaluru, Karnataka, 560091",8447930692,4.9,876
Devanahalli,"Matru Arcade, 333 19Th Ward, Bb Road, Devanahalli Town, Bengaluru, Karnataka, 562110",8929436426,4.9,753
Byadrahalli,"No 15 Balaji Nagar, Magadi Main Road, Vishwaneedam Post Bydrahalli, Opposite College Stop, Bengaluru, Karnataka, 560091",8929306414,4.9,1014
Thodupuzha,"Golden Tower, Golden Tower, Manakkad Junction, SH8, Pala Thodupuzha Road, Thodupuzha, Kerala, 685584",8929277896,4.9,1552
Kazhakootam,"Technopark Phase1 Gate, Trivandrum Bypass Road, Kazhakootam, Near Punjab National Bank, Thiruvananthapuram, Kerala, 695582",8929854948,4.8,1551
Sasthamangalam,"Shop 3 & 5, Ground Floor, Tc 9/2284, Green Trends Building, Sasthamangalam, Green Trends Building, Thiruvananthapuram, Kerala, 695010",9582381389,4.9,3464
MG Road Trivandrum,"TC 38/1626, Mg Road, Thiruvananthapuram, Kerala, 695036",8826001599,4.9,3746
Sreekariyam,"TC 5/3568-1, Palakattu Veedu, Chenthy Pongumoodu, Medical College Po, Sreekariyam, Thiruvananthapuram, Kerala, 695011",8447842236,4.9,1478
MG Road,"Shop KMC 32/2280, Bendichal Commercial Complex, MG Road, Press Club junction, Kasaragod, Kerala, 671121",9873159134,,0
VIP Road,"Shop No G 1, Roongta Arcade, VIP Road, Vesu, Opposite Nandanvan 2, Surat, Gujarat, 395007",7303212213,4.9,1841
Alkapuri Vadodara,"Shop No 1 To 3, Ground Floor, Meghdhanush Complex, Alkapuri, Race Course Road, Near Bird Circle, Paris Nagar, Diwalipura, Vadodara, Gujarat, 390007",9898061232,,0
Patan,"Shop No 8/G & 9/G, Haridarshan Complex, Opposite Dsp Office, Patan, Gujarat, 384265",8447614463,4.9,485
"New City Light, Althan","Ground Floor, Samarth Aquistic, New City Light Road, Althan, Near Mega Marriage Hall, Surat, Gujarat, 395007",7428891224,4.9,1396
Supermall 2 Infocity,"Shop No 5,Groud Floor,Supermall 2, Near HDFC Bank, Infocity, Gandhinagar, Gujarat, 382010",9582383297,4.9,670
Gunjan,"Shop No 7, Adarsh Vihar, Gunjan Cinema, Vapi, Gujarat, 396195",7428890196,4.8,772
Sadhuvasvani Road,"G01, Everest Enclave, Yogi Chowk, Near Gangotri Dairy, RMC Garden, Sadhuvasvani Road, Rajkot, Gujarat, 360005",9582600198,4.9,418
"Domestic Terminal 2, Mumbai Airport","Chhatrapati Shivaji International Airport, Vile Parle East, Domestic Terminal 2, Second Shop On Left After Security Check, Mumbai, Maharashtra, 400099",7428891299,4.9,911
"Infiniti Mall, Malad","Shop No 18, Lower Ground Floor, Link Road, Malad West, Infiniti Mall, Malad, Opposite Iphone Store, Mumbai, Maharashtra, 400064",7428891300,4.9,2963
Gokulpeth,"Purshottam Complex, Nort Bazar Road, Gokulpeth, Nagpur, Maharshtra, 440010",9582476098,4.8,1050
Panchsheel Square,"Shop No 4 & 5, Rajkamal Complex, Dhantoli, Near Panchsheel Square, Nagpur, Maharashtra, 440012",8929310929,4.8,2324
Seawoods,"Shop No 61 & 62, Shelter Arcade, Seawoods Sector 42, Navi Mumbai, Maharashtra, 400706",7303560561,4.6,521
"Oriana Crest, Wakad","Shop No 3, Oriana Crest, Datta Mandir Road, Postal Colony, Wakad, Wakad, Opp Vitalife, Pune, Maharashtra, 411057",7303546547,4.8,1403
"Prozone Mall, Aurangabad","P 80, Prozone Mall, Unit No G 53, Midc Api Road, Chilkalthana, Near Mcdonalds, Aurangabad, Maharashtra, 431210",7428891313,4.8,1186
Bhayandar West,"Shop No 1 & 2, Shani Plaza, Station Road, Near Union Bank Of India, Thane Mira Road, West Bhayandar, Maharashtra, 401101",9582478473,4.9,324
Flagship Store Banashankari,"Shop No 214, 15Th Main, 24Th Cross, Banashankari 2Nd Stage, Near Bda Complex, Bengaluru, Karnataka, 560070",7428891328,4.8,1997
Andrahalli,"Ground Floor, 38 Md Complex, Doddanna Layout, Andrahalli, Bengaluru, Karnataka, 560091",8929327932,5.0,1399
New Bel Road,"No 004/B, Ground Floor, Devasandra Layout, New Bel Road, Next To Subway, Bengaluru, Karnataka, 560094",7303563564,4.9,1370
Btm Layout,"Shop No 2, Building No 805/A, Pid No-65-94-805/A, 7Th Cross Road, Btm Layout, 2Nd Stage, Btm Layout, Opposite Wild Craft, Bengaluru, Karnataka, 560076",8929261833,4.9,929
Flagship Store Kathriguppe,"#4, 6th Block, 3rd Phase, 80 Feet Road, Near Big Bazaar, 3rd Phase, Kathriguppe, Banashankari, Bengaluru, Karnataka, 560085",8447725949,4.9,1866
Saraswathipuram,"2904/1, Khada No Ch 66, Kantharaj Urs Road, Saraswathipuram, Beside Fire Brigade, Mysuru, Karnataka, 570009",8929342669,4.9,2614
Focus Mall,"Room No 61/10510,61/105115, Ground Floor, Focus Mall, Rajaji Road, Kozhikode, Calicut, Kerala, 673004",8929330673,5.0,4145
Flagship Store Alleppy,"24/118 A Vada Canal Road, Ymca Junction, Opposite Hp Petrol Pump, Alleppey, Kerala, 688001",8929438468,4.9,2718
Paruthipara,"Tc 31/142-3, Kunnirikkal Building, Paruthipara, Thiruvananthapuram, Kerala, 695025",9667183184,4.9,858
